No,Destination Name,Address,Subdistrict,Regency,Latitude,Longitude,Category 1,Category 2 ,Category 3,Rating,Google Reviews (Count),Source,Child Entry,Adults Entry,Normal Hotel Price
1,Tanah Lot,"Beraban, Kec. Kediri, Kabupaten Tabanan, Bali 82121",Kediri,Tabanan,-8.6212,115.0868,Historical Landmark,Temple,Tourist Destination,4.6,75899,"https://www.google.com/maps/place/Tanah+Lot/@-8.6212118,115.0846145,17z/data=!4m5!3m4!1s0x2dd237824f71deab:0xcaabe270f7e34d69!8m2!3d-8.621213!4d115.086807","Rp30,000","Rp60,000",
2,Mount Batur,"Bangli, Bali, Indonesia",Kintamani,Bangli,-8.2389,115.3775,Mountain,Lake,Tourist Destination,4.5,2580,"https://www.google.com/maps/place/Mt+Batur/@-8.2401298,115.3774944,14z/data=!3m1!4b1!4m5!3m4!1s0x2dd1f403c8e8ee3f:0xd38045afa18670b4!8m2!3d-8.2401299!4d115.3774944",,,
3,Uluwatu Temple,"Uluwatu (South Kuta, Badung)",Kuta,Badung,-8.8291,115.0849,Temple,Historical Landmark,Tourist Destination,4.6,28800,"https://www.google.com/maps/place/Uluwatu+Temple/@-8.8293567,115.0851721,17z/data=!3m1!4b1!4m5!3m4!1s0x2dd24ffc20cb8191:0xcb98d1ba7db0495!8m2!3d-8.8291432!4d115.0849069","Rp15,000","Rp30,000",
4,Ubud Monkey Forest,"Jl. Monkey Forest, Ubud, Kecamatan Ubud, Kabupaten Gianyar, Bali 80571",Ubud,Gianyar,-8.5194,115.2606,Wildlife,Forest,Tourist Destination,4.5,36099,"https://www.google.com/maps/place/Sacred+Monkey+Forest+Sanctuary/@-8.5193727,115.2606299,17z/data=!3m1!4b1!4m5!3m4!1s0x2dd23d43f6189b67:0xb6ec43164befc356!8m2!3d-8.5193727!4d115.2606299","Rp40,000","Rp50,000",
5,Goa Gajah,"Gianyar, Bali",Ubud,Gianyar,-8.5069,115.2625,Historical Landmark,Temple,Tourist Destination,4.2,6683,"https://www.google.com/maps/place/Goa+Gajah/@-8.5234022,115.2868531,17z/data=!3m1!4b1!4m5!3m4!1s0x2dd216319e3e8cbb:0xcf6f85fcf798a545!8m2!3d-8.5234378!4d115.2871568","Rp25,000","Rp50,000",
6,Jatiluwih Rice Terraces in Bali,"Village, Jl. Jatiluwih Kawan No.Desa, Jatiluwih, Kec. Penebel, Kabupaten Tabanan, Bali 82152",Penebel,Tabanan,-8.3686,115.1305,Rice Field,Countryside,Tourist Destination,4.7,7798,"https://www.google.com/maps/place/Jatiluwih+Rice+Terraces/@-8.37031,115.131372,17z/data=!3m1!4b1!4m5!3m4!1s0x2dd227ab020cd7fb:0x2f0f875ff3e6839a!8m2!3d-8.37031!4d115.131372","Rp40,000","Rp40,000",
7,Tenggalang Rice Terrace,"Jl. Raya Tegallalang, Tegallalang, Kec. Tegallalang, Kabupaten Gianyar, Bali 80561",Tegallalang,Gianyar,-8.4028,115.288,Rice Field,Countryside,Tourist Destination,4.4,33732,"https://www.google.com/maps/place/Tegallalang+Rice+Terrace/@-8.4340403,115.2792569,17z/data=!3m1!4b1!4m5!3m4!1s0x2dd2220b23f900e3:0x8d1a8969386c04ed!8m2!3d-8.4340403!4d115.2792569","Rp20,000","Rp20,000",
8,Pura Ulun Danu Bratan,"Danau Beratan, Candikuning, Kec. Baturiti, Kabupaten Tabanan, Bali 82191",Baturiti,Tabanan,-8.2753,115.1664,Historical Landmark,Temple,Tourist Destination,4.7,29178,"https://www.google.com/maps/place/Ulun+Danu+Beratan+Temple/@-8.2751807,115.1668234,17z/data=!3m1!4b1!4m5!3m4!1s0x2dd1896c9fac0857:0x18246568e4db1b53!8m2!3d-8.2751807!4d115.1668234","Rp25,000","Rp50,000",
9,Seminyak Beach,"Kuta, Badung, Bali",Kuta,Badung,-8.6913,115.1682,Beach,Beachside,Tourist Destination,4.5,3195,"https://www.google.com/maps/place/Seminyak+Beach/@-8.6899792,115.1562856,15z/data=!3m1!4b1!4m5!3m4!1s0x2dd2471c804bfd05:0xdcc2b5ae63dc9082!8m2!3d-8.6920123!4d115.1578837",,,
10,Nusa Dua Beach,"Kuta, Badung, Bali",Kuta,Badung,-8.7941,115.2302,Beach,Beachside,Tourist Destination,4.6,6171,"https://www.google.com/maps/place/Nusa+Dua+Beach/@-8.8004119,115.2360119,14z/data=!3m1!4b1!4m5!3m4!1s0x2dd242d6feba16fd:0x84a7328be1e50953!8m2!3d-8.8004121!4d115.2360119",,,
11,Besakih Temple (Pura Besakih),"Besakih countryside, Rendang sub district, Karangasem, Bali",Rendang,Karangasem,-8.3739,115.4522,Historical Landmark,Temple,Tourist Destination,4.5,9672,"https://www.google.com/maps/place/Besakih+Great+Temple/@-8.3738651,115.4522394,17z/data=!4m5!3m4!1s0x2dd21cbe3748b2b7:0xbfc39798cd1bb4a!8m2!3d-8.3738651!4d115.4522394","Rp30,000","Rp60,000",
12,Kuta Beach,"Kuta District, Badung, southern Bali",Kuta,Badung,-8.7185,115.1686,Beach,Beachside,Tourist Destination,4.5,37663,"https://www.google.com/maps/place/Kuta+Beach/@-8.7180325,115.1680346,15z/data=!3m1!4b1!4m5!3m4!1s0x2dd246bc2ab70d43:0x82feaae12f4ab48e!8m2!3d-8.7184926!4d115.1686322",,,
13,Pura Penataran Agung Lempuyang,"Jl. Pura Telaga Mas Lempuyang, Tri Buana, Kec. Abang, Kabupaten Karangasem, Bali 80852",Abang,Karangasem,-8.3915,115.6313,Historical Landmark,Temple,Tourist Destination,4.3,6192,"https://www.google.com/maps/place/Pura+Penataran+Agung+Lempuyang/@-8.3913794,115.6306937,17z/data=!3m1!4b1!4m5!3m4!1s0x2dd2071753222893:0x40a0fd58fe779263!8m2!3d-8.3913712!4d115.630697","Rp115,000","Rp115,000",
14,Sidemen Valley,Karangasem in East Bali,Karangasem,Karangasem,-8.4845,115.4447,Mountain,Rice Field,Tourist Destination,4.3,172,"https://www.google.com/maps/place/Bali+Countryside+Sidemen/@-8.505544,115.3557232,12z/data=!4m10!1m2!2m1!1ssidemen+valley!3m6!1s0x2dd210f87453e769:0x6c3a2008aef6f898!8m2!3d-8.505544!4d115.425761!15sCg5zaWRlbWVuIHZhbGxleZIBEnRvdXJpc3RfYXR0cmFjdGlvbuABAA!16s%2Fg%2F11bwkgmsh7",,,
15,Tirta Empul Temple,"Jl. Tirta, Manukaya, Kec. Tampaksiring, Kabupaten Gianyar, Bali 80552",Tampaksiring,Gianyar,-8.4147,115.3155,Spiritual Journey,Water Temple,Tourist Destination,4.6,16456,"https://www.google.com/maps/place/Pura+Tirta+Empul/@-8.4157038,115.3153042,17z/data=!3m1!4b1!4m5!3m4!1s0x2dd218f4e06131b5:0x53a25a017714ecc1!8m2!3d-8.4158511!4d115.3150247","Rp25,000","Rp50,000",
16,West Bali National Park,"Buleleng, Bali, Indonesia",Buleleng,Buleleng,-8.1333,114.4833,Wildlife,National Park,Tourist Destination,4.5,2912,"https://www.google.com/maps/place/West+Bali+National+Park/@-8.1276114,114.4731514,17z/data=!3m1!4b1!4m5!3m4!1s0x2dd143657d50a467:0xc6efbc99a654d0b2!8m2!3d-8.1276114!4d114.4753401","Rp300,000","Rp300,000",
17,Garuda Wisnu Kencana Cultural Park,"Uluwatu St, Ungasan, South Kuta, Badung, Bali 80364",Kuta,Badung,-8.8104,115.1676,Historical Landmark,National Park,Tourist Destination,4.5,50703,"https://www.google.com/maps/place/Garuda+Wisnu+Kencana+Cultural+Park/@-8.8104228,115.1675986,17z/data=!3m1!4b1!4m6!3m5!1s0x2dd244cf54e1dec7:0x1988663e064f5a51!8m2!3d-8.8104228!4d115.1675986!16zL20vMGRyenpx?authuser=0&hl=en","Rp100,000","Rp125,000",
18,Bali Zoo,"Jl. Raya Singapadu, Singapadu, Kec. Sukawati, Kabupaten Gianyar, Bali 80582",Sukawati,Gianyar,-8.5913,115.2659,Wildlife,Family-Friendly,Tourist Destination,4.4,14401,"https://www.google.com/maps/place/Bali+Zoo/@-8.5912638,115.2659161,17z/data=!3m1!4b1!4m6!3m5!1s0x2dd23e3e4361eea5:0x3bf4eb36bfd7c6be!8m2!3d-8.5912638!4d115.2659161!16s%2Fg%2F1tk_rlbg?authuser=0&hl=en","Rp90,000","Rp90,000",
19,Bali Bird Park,"Jl. Serma Cok Ngurah Gambir Singapadu, Batubulan, Kec. Sukawati, Kabupaten Gianyar, Bali 80582",Sukawati,Gianyar,-8.6,115.2511,Wildlife,Family-Friendly,Tourist Destination,4.6,9847,"https://www.google.com/maps/place/Bali+Bird+Park/@-8.59998,115.25185,17z/data=!3m1!4b1!4m6!3m5!1s0x2dd23e4efac54c0f:0x5f8920acf656382c!8m2!3d-8.59998!4d115.25185!16s%2Fm%2F0_fn070?authuser=0&hl=en","Rp192,500","Rp385,000",
20,Tirta Gangga,"Jalan Raya Abang Desa Adat, Ababi, Kec. Abang, Kabupaten Karangasem, Bali 80852",Abang,Karangasem,-8.4123,115.5873,Water Palace,Temple,Tourist Destination,4.6,12992,"https://www.google.com/maps/place/Tirta+Gangga/@-8.4123473,115.5872919,17z/data=!3m1!4b1!4m6!3m5!1s0x2dd24736f4379ad1:0x65af03b0d108a7d1!8m2!3d-8.4123473!4d115.5872919!16s%2Fm%2F09rv951?authuser=0&hl=en","Rp50,000","Rp50,000",
21,Tegenungan Waterfall,"Jl. Ir. Sutami, Kemenuh, Kec. Sukawati, Kabupaten Gianyar, Bali 80581",Sukawati,Gianyar,-8.5754,115.2888,Waterfall,Cliff,Tourist Destination,4.3,23349,"https://www.google.com/maps/place/Tegenungan+Waterfall/@-8.5753506,115.288777,17z/data=!3m1!4b1!4m6!3m5!1s0x2dd2161beebd0c61:0xc1ae79ddb8410c5e!8m2!3d-8.5753134!4d115.2887691!16s%2Fg%2F11bvx3j8m8?authuser=0&hl=en","Rp10,000","Rp15,000",
22,Bali Swing,"Jl. Dewi Saraswati No.7, Bongkasa Pertiwi, Kec. Abiansemal, Kabupaten Badung, Bali 80352",Abiansemal,Badung,-8.4936,115.2392,Rice Field,Countryside,Tourist Destination,4.5,8311,"https://www.google.com/maps/place/Bali+Swing/@-8.4886834,115.2392541,17z/data=!3m1!4b1!4m6!3m5!1s0x2dd23d2bb78f98e5:0xdc87cb5e74348952!8m2!3d-8.4886742!4d115.2392573!16s%2Fg%2F11dxl6hnl9?authuser=0&hl=en","Rp250,000","Rp250,000",
23,Waterboom Bali,"Jl. Kartika Plaza, Tuban, Kec. Kuta, Kabupaten Badung, Bali 80361",Kuta,Badung,-8.7286,115.1694,Water Activities,Family-Friendly,Tourist Destination,4.7,10650,"https://www.google.com/maps/place/Waterbom+Bali/@-8.7285745,115.1693743,17z/data=!3m1!4b1!4m6!3m5!1s0x2dd246a3ee8f82df:0x1291d693f3407fa5!8m2!3d-8.7285759!4d115.1693786!16s%2Fg%2F1tdz276n?authuser=0&hl=en","Rp355,000","Rp495,000",
24,Campuhan Ridge Walk,"Kelusa, Payangan, Jl. Raya Campuhan, Sayan, Kecamatan Ubud, Kabupaten Gianyar, Bali 80571",Ubud,Gianyar,-8.5036,115.2547,Hiking,Countryside,Tourist Destination,4.4,9019,"https://www.google.com/maps/place/Campuhan+Ridge+Walk/@-8.5036172,115.2547038,17z/data=!3m1!4b1!4m6!3m5!1s0x2dd23d6bcaf473f5:0x7c13fd74aa1bc49f!8m2!3d-8.5036172!4d115.2547038!16s%2Fg%2F11bv_dhkhx?authuser=0&hl=en",,,
25,Bali Safari and Marine Park,"Jl. Prof. Dr. Ida Bagus Mantra No.km 19, Serongga, Kec. Gianyar, Kabupaten Gianyar, Bali 80551",Gianyar,Gianyar,-8.5908,115.342,Wildlife,Family-Friendly,Tourist Destination,4.4,16042,"https://www.google.com/maps/place/Bali+Safari+and+Marine+Park/@-8.580947,115.3452337,17z/data=!3m1!4b1!4m6!3m5!1s0x2dd21446b81f7d39:0x34b39c786c2e54ec!8m2!3d-8.580947!4d115.3452337!16s%2Fm%2F0lkqtcl?authuser=0&hl=en","Rp576,000","Rp720,000",
26,Bajra Sandhi Monument,"Jl. Raya Puputan No.142, Panjer, Denpasar Selatan, Kota Denpasar, Bali 80234",Denpasar Selatan,Denpasar,-8.6717,115.2339,Historical Landmark,Museum,Tourist Destination,4.6,12694,"https://www.google.com/maps/place/Bajra+Sandhi+Monument/@-8.6717348,115.233902,17z/data=!3m1!4b1!4m6!3m5!1s0x2dd240f5b0baad2f:0xf67150ab4e009a2c!8m2!3d-8.6717348!4d115.233902!16s%2Fm%2F0n45qhz?authuser=0&hl=en","Rp15,000","Rp30,000",
27,Sukawati Art Market,"Jalan Raya Sukawati, Sukawati, Kec. Sukawati, Kabupaten Gianyar, Bali 80582",Sukawati,Gianyar,-8.5965,115.2826,Local Market,Countryside,Tourist Destination,4.3,8248,"https://www.google.com/maps/place/Sukawati+Art+Market/@-8.5965307,115.2826055,17z/data=!3m1!4b1!4m6!3m5!1s0x2dd23e28616c410d:0x960eaffe9f543e3c!8m2!3d-8.5965307!4d115.2826055!16s%2Fg%2F11gzm8537?authuser=0&hl=en",,,
28,Taman Ujung,"Ujung Water Palace, Tumbu, Kec. Karangasem, Kabupaten Karangasem, Bali 80811",Karangasem,Karangasem,-8.4631,115.6307,Water Palace,Countryside,Tourist Destination,4.6,3984,"https://www.google.com/maps/place/Taman+Ujung/@-8.4630811,115.6306692,17z/data=!3m1!4b1!4m6!3m5!1s0x2dd20876e3e79815:0xfc9ab3edaa5d11f2!8m2!3d-8.4630811!4d115.6306692!16s%2Fm%2F011l7bd6?authuser=0&hl=en","Rp75,000","Rp75,000",
29,Secret Garden Village,"Jl. Raya Denpasar Bedugul km. 36, Mekarsari, Baturiti, Mekarsari, Tabanan, Mekarsari, Kec. Baturiti, Kabupaten Tabanan, Bali 82191",Baturiti,Tabanan,-8.3727,115.1933,Countryside,Hands On Activities,Tourist Destination,4.6,4432,"https://www.google.com/maps/place/Secret+Garden+Village/@-8.3726762,115.1933301,17z/data=!3m1!4b1!4m9!3m8!1s0x2dd2212ba32a0087:0xabd3c3b7c8f647ef!5m2!4m1!1i2!8m2!3d-8.3726794!4d115.1933311!16s%2Fg%2F11cjhzdxpb?authuser=0&hl=en","Rp45,000","Rp45,000",
30,Penglipuran Village,"Jl. Penglipuran, Kubu, Kec. Bangli, Kabupaten Bangli, Bali 80611",Bangli,Bangli,-8.4219,115.3589,Traditional Villages,Countryside,Tourist Destination,4.8,13207,"https://www.google.com/maps/place/Penglipuran+Village/@-8.4222473,115.359306,17z/data=!3m1!4b1!4m6!3m5!1s0x2dd2196eace4f4a9:0x3319169adf0c3419!8m2!3d-8.4222473!4d115.359306!16s%2Fg%2F11g6htx9w5?authuser=0&hl=en","Rp50,000","Rp50,000",
31,Banjar Hot Spring,"Jalan Banjar, Banjar, Kec. Banjar, Kabupaten Buleleng, Bali 81152",Banjar,Buleleng,-8.2105,114.9671,Hostprings,Water Temple,Tourist Destination,4.3,2422,"https://www.google.com/maps/place/Banjar+Hot+Spring/@-8.210536,114.967053,17z/data=!3m1!4b1!4m6!3m5!1s0x2e6f62183e68d4d7:0xd6004ccdd7930d5e!8m2!3d-8.210536!4d114.967053!16s%2Fg%2F1q62gc8c0?authuser=0&hl=en","Rp20,000","Rp20,000",
32,Bali Pulina,"Jl. Raya Pujung Kaja, Sebatu, Kec. Tegallalang, Kabupaten Gianyar, Bali 80561",Tegallalang,Gianyar,-8.4227,115.2788,Coffee Plantation,Countryside,Tourist Destination,4.5,3960,"https://www.google.com/maps/place/Bali+Pulina/@-8.4227455,115.2788239,17z/data=!3m1!4b1!4m6!3m5!1s0x2dd222990001f90b:0x46117dc3c84b0af2!8m2!3d-8.4227455!4d115.2788239!16s%2Fg%2F11bc7r5jvk?authuser=0&hl=en","Rp100,000","Rp100,000",
33,Goa Lawah Temple,"CFX9+9GG, Jl. Raya Goa Lawah, Pesinggahan, Kec. Dawan, Kabupaten Klungkung, Bali 80761",Dawan,Klungkung,-8.5516,115.4688,Temple,Cave,Tourist Destination,4.7,4479,"https://www.google.com/maps/place/Goa+Lawah+Temple/@-8.5515731,115.4688279,17z/data=!3m1!4b1!4m6!3m5!1s0x2dd212002b27b8a9:0x64d9703162191aad!8m2!3d-8.5515375!4d115.468823!16s%2Fg%2F11g9swjzff?authuser=0&hl=en","Rp20,000","Rp20,000",
34,Pantai Batu Bolong,"Jl. Pantai Batu Bolong, Canggu, Kec. Kuta Utara, Kabupaten Badung, Bali",Kuta Utara,Badung,-8.6595,115.1301,Beach,Cave,Tourist Destination,4.4,7248,"https://www.google.com/maps/place/Pantai+Batu+Bolong/@-8.6594822,115.1301361,15z/data=!3m1!4b1!4m6!3m5!1s0x2dd2478621f5b693:0xa157bd1e893b4293!8m2!3d-8.6594824!4d115.1301361!16s%2Fg%2F1hc2cr7jt?authuser=0&hl=en","Rp10,000","Rp10,000",
35,The Anvaya Beach Resort Bali,"Jl. Kartika Plaza, Tuban, Kec. Kuta, Kabupaten Badung, Bali 80361, Indonesia",Kuta,Badung,-8.7322397,115.1659119,Stays,High End Hotel,Beachside Resort,4.7,10830,https://maps.google.com/?cid=1437900499782659408,,,"Rp5,022,000"
36,The Apurva Kempinski Bali,"Jl. Raya Nusa Dua Selatan lot 4, Benoa, Kec. Kuta Sel., Kabupaten Badung, Bali 80361, Indonesia",Kuta Selatan,Badung,-8.8285518,115.215578,Stays,Luxury Hotel,Beachside Resort,4.8,10117,https://maps.google.com/?cid=5218857665333554588,,,"Rp14,520,640"
37,"The Westin Resort Nusa Dua, Bali","Kawasan Pariwisata Nusa Dua, BTDC Lot N-3, Benoa, Kec. Kuta Sel., Nusa Dua, Bali 80363, Indonesia",Kuta Selatan,Badung,-8.795935,115.23051,Stays,Premium Hotel,Beachside Resort,4.6,6792,https://maps.google.com/?cid=9388798821997018730,,,"Rp4,001,067"
38,The Sakala Resort Bali - All Suites,"Jl. Pratama No.95, Benoa, Kec. Kuta Sel., Kabupaten Badung, Bali 80363, Indonesia",Kuta Selatan,Badung,-8.7593706,115.2214357,Stays,Premium Hotel,Beachside Resort,4.4,2698,https://maps.google.com/?cid=6346064753129292306,,,"Rp2,400,000"
39,Discovery Kartika Plaza Bali,"Jl. Kartika Plaza, Kuta, Kec. Kuta Sel., Kabupaten Badung, Bali 80361, Indonesia",Kuta Selatan,Badung,-8.7295641,115.1658425,Stays,Premium Hotel,Beachside Resort,4.4,4861,https://maps.google.com/?cid=6094745359386703154,,,"Rp1,733,333"
40,Urban Styles Inata Bisma Ubud,"Jl. Bisma, Ubud, Kecamatan Ubud, Kabupaten Gianyar, Bali 80571, Indonesia",Ubud,Gianyar,-8.515003,115.2580899,Stays,Standard Hotel,Countryside Villa,4.2,222,https://maps.google.com/?cid=12767175653709021041,,,"Rp810,000"
41,Hilton Bali Resort,"Jl. Raya Nusa Dua Selatan, Benoa, Kec. Kuta Sel., Kabupaten Badung, Bali 80361, Indonesia",Kuta Selatan,Badung,-8.8256848,115.2186745,Stays,Premium Hotel,Beachside Resort,4.6,8404,https://maps.google.com/?cid=7194324978140935542,,,"Rp3,872,000"
42,The ONE Legian,"Jl. Raya Legian No.117, Kuta, Kec. Kuta, Kabupaten Badung, Bali 80361, Indonesia",Kuta,Badung,-8.71403,115.173611,Stays,Standard Hotel,Beachside Hotel,4.3,4910,https://maps.google.com/?cid=5539774582936131903,,,"Rp1,440,000"
43,Prama Sanur Beach Bali,"Jalan Cemara Sanur, Sanur Kauh, Denpasar Selatan, Kota Denpasar, Bali 80228, Indonesia",Denpasar Selatan,Denpasar,-8.7094607,115.2564662,Stays,Premium Hotel,Beachside Resort,4.5,4735,https://maps.google.com/?cid=3607576252505802138,,,"Rp2,268,000"
44,Ramada Encore by Wyndham Bali Seminyak,"Jl. Dewi Saraswati III, Seminyak, Kec. Kuta, Kota Denpasar, Bali 80361, Indonesia",Kuta,Badung,-8.6854918,115.1761508,Stays,Premium Hotel,City Hotel,4.4,5815,https://maps.google.com/?cid=12001731388320182487,,,"Rp1,642,500"
45,ASTON Kuta Hotel & Residence,"Jl. Wana Segara No.2, Kuta, Kec. Kuta, Kabupaten Badung, Bali 80361, Indonesia",Kuta,Badung,-8.7368923,115.1655371,Stays,Premium Hotel,City Hotel,4.5,3760,https://maps.google.com/?cid=17896977147866980907,,,"Rp1,989,000"
46,Merusaka Nusa Dua,"Kawasan Wisata Nusa Dua Lot S-3, Benoa, Kec. Kuta Sel., Kabupaten Badung, Bali 80363, Indonesia",Kuta Selatan,Badung,-8.8049707,115.2294223,Stays,Premium Hotel,Beachside Resort,4.6,8212,https://maps.google.com/?cid=6640509008423919136,,,"Rp3,199,500"
47,Kanishka Villas,"Jalan Kunti I Gang Mangga No. 8Y, Seminyak, Kec. Kuta, Kabupaten Badung, Bali 80361, Indonesia",Kuta,Badung,-8.6887944,115.1688681,Stays,Standard Hotel,Villa,4.2,351,https://maps.google.com/?cid=4968539616201352290,,,"Rp1,435,745"
48,Kanvaz Village Resort Seminyak,"Jl. Petitenget No.188, Seminyak, Kec. Kuta Utara, Kabupaten Badung, Bali 80361, Indonesia",Kuta Utara,Badung,-8.6767634,115.1548259,Stays,Premium Hotel,Boutique Villa,4.7,1100,https://maps.google.com/?cid=5506595315661473369,,,"Rp3,211,884"
49,RIMBA by AYANA Bali,"645Q+4QQ Sky Bridge from Rimba to Ayana Hotel, Estate Sejahtera, Rimba Jimbaran, Jl. Karang Mas, Jimbaran, South Kuta, Badung, Bali 80361, Indonesia",Kuta Selatan,Badung,-8.7934334,115.1394673,Stays,Premium Hotel,Beachside Resort,4.7,5911,https://maps.google.com/?cid=13458810559621731687,,,"Rp3,908,300"
50,Grand Inna Kuta,"Jl. Pantai Kuta No.1, Pande Mas, Kuta, Kec. Kuta, Kabupaten Badung, Bali 80361, Indonesia",Kuta,Badung,-8.7231271,115.1705453,Stays,Premium Hotel,Boutique Villa,4.5,5321,https://maps.google.com/?cid=14975161875348849976,,,"Rp1,920,000"
51,"Nusa Dua Beach Hotel & Spa, Bali","Kawasan Pariwisata Nusa Dua Lot. North 4, Jl. Nusa Dua, Benoa, South Kuta, Badung, Bali 80363, Indonesia",Kuta,Badung,-8.7940956,115.2301618,Stays,Premium Hotel,Beachside Resort,4.6,3472,https://maps.google.com/?cid=10594663883797844500,,,"Rp3,825,858"
52,Mercure Bali Nusa Dua,"Jalan Nusa Dua Selatan Lot Sw 03, Jl. Nusa Dua, Benoa, Kec. Kuta Sel., Kabupaten Badung, Bali 80363, Indonesia",Kuta Selatan,Badung,-8.806821,115.22175,Stays,Standard Hotel,City Hotel,4.3,2855,https://maps.google.com/?cid=9564002293397590456,,,"Rp1,012,044"
53,Padma Resort Ubud,"Padma Resort Ubud Banjar Carik, Desa, Puhu, Kec. Payangan, Kabupaten Gianyar, Bali 80572, Indonesia",Payangan,Gianyar,-8.3834684,115.2745404,Stays,High End Hotel,Countryside Villa,4.8,5247,https://maps.google.com/?cid=7847074353409935796,,,"Rp5,806,729"
54,Conrad Bali,"Jl. Pratama No.168, Tanjung, Benoa, Kec. Kuta Sel., Kabupaten Badung, Bali 80363, Indonesia",Kuta Selatan,Badung,-8.7812388,115.2253741,Stays,Premium Hotel,Beachside Resort,4.7,5266,https://maps.google.com/?cid=15751644144970485544,,,"Rp4,154,334"
55,Grand Hyatt Bali,"Kawasan Wisata Nusa Dua BTDC, Jl. Nusa Dua, Benoa, South Kuta, Badung, Bali 80363, Indonesia",Kuta Selatan,Badung,-8.8036711,115.2332213,Stays,Premium Hotel,Beachside Resort,4.6,8107,https://maps.google.com/?cid=4413825900116371476,,,"Rp3,325,031"
56,Horison Seminyak,"Seminyak, Jl. Arjuna Jl. Double Six, Seminyak, Kec. Kuta, Kabupaten Badung, Bali 80361, Indonesia",Kuta,Badung,-8.6966278,115.1661111,Stays,Premium Hotel,City Hotel,4.4,2387,https://maps.google.com/?cid=11031913673690622514,,,"Rp2,000,000"
57,Aryaduta Bali,"Jl. Kartika Plaza, Lingkungan Segara, Kec. Kuta, Kabupaten Badung, Bali 80361, Indonesia",Kuta,Badung,-8.735787,115.167247,Stays,Standard Hotel,Beachside Hotel,4.5,2190,https://maps.google.com/?cid=2643985164651635870,,,"Rp1,380,000"
58,Swiss Belhotel Tuban,"Jl. Kubu Anyar No.31, Tuban, Kec. Kuta, Kabupaten Badung, Bali 80361, Indonesia",Kuta,Badung,-8.7332129,115.1709632,Stays,Standard Hotel,City Hotel,4.7,6833,https://maps.google.com/?cid=12958646073613606511,,,"Rp990,667"
59,Hotel Dafam Savvoya Seminyak,"Jl. Mertanadi No.14, Seminyak, Kec. Kuta, Kabupaten Badung, Bali 80361, Indonesia",Kuta,Badung,-8.6828678,115.1672293,Stays,Standard Hotel,City Hotel,4.2,1483,https://maps.google.com/?cid=2578422462025139276,,,"Rp1,099,156"
60,The Lerina Hotel Nusa Dua,"Jl. Bypass Ngurah Rai No.1001X, Benoa, Kec. Kuta Sel., Kabupaten Badung, Bali 80361, Indonesia",Kuta Selatan,Badung,-8.785802,115.20189,Stays,Standard Hotel,Beachside Hotel,4.3,2051,https://maps.google.com/?cid=4606796864938249445,,,"Rp945,000"
61,Four Star by Trans Hotel,"Jl. Raya Puputan No.200, Renon, Denpasar Selatan, Kota Denpasar, Bali 80226, Indonesia",Denpasar Selatan,Denpasar,-8.6738003,115.2423278,Stays,Standard Hotel,City Hotel,4.5,862,https://maps.google.com/?cid=12391683175558311121,,,"Rp760,000"
62,Bali Dynasty Resort,"Jl. Kartika Plaza, Tuban, Kec. Kuta, Kabupaten Badung, Bali 80361, Indonesia",Kuta,Badung,-8.7312998,115.1660484,Stays,Premium Hotel,Beachside Resort,4.5,4163,https://maps.google.com/?cid=5977490526561786738,,,"Rp2,097,144"
63,Wyndham Garden Kuta Beach Bali,"Jl. Pantai Kuta No.99 X, Legian, Kec. Kuta, Kabupaten Badung, Bali 80361, Indonesia",Kuta,Badung,-8.7122181,115.1678406,Stays,Standard Hotel,City Hotel,4.1,1666,https://maps.google.com/?cid=3625007746644824811,,,"Rp1,032,000"
64,Hotel Santika Siligita Nusa Dua,"Banjar Peminge, Jl. Siligita No.3A, Nusa Dua, Benoa, Kec. Kuta Sel., Kabupaten Badung, Bali 80571, Indonesia",Kuta Selatan,Badung,-8.8048542,115.2220182,Stays,Standard Hotel,Beachside Hotel,4.4,1953,https://maps.google.com/?cid=8452002582376478021,,,"Rp1,166,667"
65,Sheraton Bali Kuta Resort,"Jl. Pantai Kuta, Kuta, Kec. Kuta, Kabupaten Badung, Bali 80361, Indonesia",Kuta,Badung,-8.7182893,115.1695705,Stays,Premium Hotel,Beachside Resort,4.7,6624,https://maps.google.com/?cid=11166494907059452735,,,"Rp3,468,667"
66,Tribe Bali Kuta Beach,"Jl. Pantai Kuta No.99, Legian, Kec. Kuta, Kabupaten Badung, Bali 80361, Indonesia",Kuta,Badung,-8.712541,115.167766,Stays,Premium Hotel,Beachside Hotel,4.5,680,https://maps.google.com/?cid=5806778546963391030,,,"Rp1,637,857"
67,Kaisa Villas Seminyak,"Jl. Bali Deli No.88, Seminyak, Kec. Kuta, Kabupaten Badung, Bali 80361, Indonesia",Kuta,Badung,-8.6866237,115.1695392,Stays,Premium Hotel,Villa,4.4,189,https://maps.google.com/?cid=12517064069479348342,,,"Rp2,450,000"
68,Novotel Bali Nusa Dua - Hotel & Residences,"Jl. Pantai Mengiat, Benoa, Kec. Kuta Sel., Bali, 80363, Indonesia",Kuta Selatan,Badung,-8.8080515,115.2265242,Stays,Premium Hotel,Beachside Resort,4.7,6010,https://maps.google.com/?cid=9756156381209995845,,,"Rp1,902,120"
69,Danoya Villa Seminyak,"Jl. Batubelig No. 559, Seminyak, Kerobokan Kelod, Kec. Kuta Utara, Kabupaten Badung, Bali 80361, Indonesia",Kuta Utara,Badung,-8.6729146,115.1548373,Stays,Premium Hotel,Villa,4.3,585,https://maps.google.com/?cid=15933322794474076960,,,"Rp3,663,000"
70,Grand Palace Hotel Sanur - Bali,"Jl. Bypass Ngurah Rai No.165, Sanur, Denpasar Selatan, Kota Denpasar, Bali 80228, Indonesia",Denpasar Selatan,Denpasar,-8.6877061,115.2589775,Stays,Standard Hotel,City Hotel,4.5,1111,https://maps.google.com/?cid=17787088249624482208,,,"Rp1,035,000"
71,HARRIS Hotel and Conventions Denpasar Bali,"Jl. Cokroaminoto No.23-25, Pemecutan Kaja, Kec. Denpasar Utara, Kota Denpasar, Bali 80118, Indonesia",Denpasar Utara,Denpasar,-8.6448542,115.2089185,Stays,Standard Hotel,City Hotel,4.4,3394,https://maps.google.com/?cid=17027610622116358414,,,"Rp568,000"
72,THE 1O1 Bali Oasis Sanur,"Jl. Danau Tamblingan No.136A, Sanur, Denpasar Selatan, Kota Denpasar, Bali 80228, Indonesia",Denpasar Selatan,Denpasar,-8.6954135,115.2636496,Stays,Standard Hotel,City Hotel,4.2,1323,https://maps.google.com/?cid=9510219289894830067,,,"Rp1,492,000"
73,HARRIS Hotel Kuta Tuban Bali,"Jl. Dewi Sartika, Tuban, Kec. Kuta, Kabupaten Badung, Bali 80361, Indonesia",Kuta,Badung,-8.7403304,115.1669791,Stays,Standard Hotel,City Hotel,4.5,4110,https://maps.google.com/?cid=17874279228357216470,,,"Rp973,333"
74,Mövenpick Resort and Spa Bali,"Jimbaran Bali, Jl. Wanagiri No.1, Jimbaran, Kec. Kuta Sel., Kabupaten Badung, Bali 80362, Indonesia",Kuta Selatan,Badung,-8.785719,115.1637539,Stays,Premium Hotel,Beachside Resort,4.7,6164,https://maps.google.com/?cid=4824645644879043535,,,"Rp3,285,734"
75,Kuta Paradiso Hotel,"Jl. Kartika Plaza, Tuban, Kec. Kuta, Kabupaten Badung, Bali 80361, Indonesia",Kuta,Badung,-8.7256886,115.1701928,Stays,Premium Hotel,Beachside Hotel,4.2,3119,https://maps.google.com/?cid=1231882474347053854,,,"Rp2,240,000"
76,Diamond Hotel Kuta Bali,"Jl. Raya Kuta No.39, Kuta, Kec. Kuta, Kabupaten Badung, Bali 80361, Indonesia",Kuta,Badung,-8.7098059,115.1815339,Stays,Standard Hotel,City Hotel,4.2,435,https://maps.google.com/?cid=4781469510122444483,,,"Rp783,000"
77,Hotel Santika Seminyak,"Jl. Sunset Road No.17, Seminyak, Kec. Kuta, Kabupaten Badung, Bali 80361, Indonesia",Kuta,Badung,-8.6902159,115.1731964,Stays,Standard Hotel,City Hotel,4.5,1842,https://maps.google.com/?cid=3872854126658128628,,,"Rp985,000"
78,Hyatt Regency Bali,"Jl. Danau Tamblingan No.89, Sanur, Denpasar Selatan, Kota Denpasar, Bali 80228, Indonesia",Denpasar Selatan,Denpasar,-8.702184,115.2632407,Stays,Premium Hotel,Beachside Resort,4.7,2840,https://maps.google.com/?cid=18281155865667730568,,,"Rp3,201,881"
79,Villa Kayu Raja,"Kerobokan, Jl. Lb. Sari Jl. Petitenget No.18, Seminyak, Kec. Kuta, Kabupaten Badung, Bali 80361, Indonesia",Kuta,Badung,-8.6766874,115.1588431,Stays,Premium Hotel,Boutique Villa,4.5,1347,https://maps.google.com/?cid=1504660208011047128,,,"Rp4,130,995"
80,Pullman Bali Legian Beach,"Jl. Melasti No.1, Legian, Kec. Kuta, Kabupaten Badung, Bali 80361, Indonesia",Kuta,Badung,-8.7095159,115.1672114,Stays,Premium Hotel,Beachside Hotel,4.6,5559,https://maps.google.com/?cid=5650384792718308266,,,"Rp2,420,000"
