No,Destination Name,Address,Subdistrict,Regency,Latitude,Longitude,Category 1,Category 2 ,Category 3,Rating,Google Reviews (Count),Source,Child Entry,Adults Entry,Normal Hotel Price
272,Kampung Cenik,"Jl. Dewi Sri, Legian, Kec. Kuta, Kabupaten Badung, Bali 80361, Indonesia",Kuta,Badung,-8.7029746,115.1787828,Stays,Standard Hotel, Villa,4.4,258,https://maps.google.com/?cid=3145743299158312443,,,"Rp728,333"
273,Ananta Legian Hotel,"Jl. Werkudara No.539, Legian, Kec. Kuta, Kabupaten Badung, Bali 80361, Indonesia",Kuta,Badung,-8.6976321,115.1639628,Stays,Standard Hotel,City Hotel,3.9,330,https://maps.google.com/?cid=4800034515647978823,,,"Rp625,050"
274,Bali Mandira Beach Resort & Spa,"Jl. Padma No.2, Legian, Kec. Kuta, Kabupaten Badung, Bali 80361, Indonesia",Kuta,Badung,-8.7066107,115.1672859,Stays,High End Hotel,Beachside Resort,4.6,2096,https://maps.google.com/?cid=1538044540947656174,,,"Rp5,890,000"
275,Komaneka at Rasa Sayang,"Jl. Monkey Forest, Ubud, Kecamatan Ubud, Kabupaten Gianyar, Bali 80571, Indonesia",Ubud,Gianyar,-8.513312,115.260388,Stays,Premium Hotel,Countryside Resort,4.6,665,https://maps.google.com/?cid=13290117782325192653,,,"Rp2,700,000"
276,Hotel Grand Santhi,"Jl. Patih Jelantik No.1, Dauh Puri Klod, Kec. Denpasar Bar., Kota Denpasar, Bali 80113, Indonesia",Denpasar Barat,Denpasar,-8.6685511,115.2162119,Stays,Standard Hotel,City Hotel,4.2,1376,https://maps.google.com/?cid=14834402629116637198,,,"Rp900,000"
277,Grand Mirah Boutique Hotel,"Jl. Kaliasem No.1, Dangin Puri Kauh, Kec. Denpasar Utara, Kota Denpasar, Bali 80232, Indonesia",Denpasar Utara,Denpasar,-8.655401,115.218602,Stays,Standard Hotel,City Hotel,4.4,941,https://maps.google.com/?cid=15962427021236965362,,,"Rp607,500"
278,Ramayana Suites & Resort,"Jl. Bakung Sari, Kuta, Kec. Kuta, Kabupaten Badung, Bali 80361, Indonesia",Kuta,Badung,-8.7248254,115.1718611,Stays,Premium Hotel,Beachside Resort,4.3,1648,https://maps.google.com/?cid=8551494129976154803,,,"Rp1,710,000"
279,Keraton Jimbaran Resort,"Jl. Mrajapati, Jimbaran, Kec. Kuta Sel., Kabupaten Badung, Bali 80361, Indonesia",Kuta Selatan,Badung,-8.7717555,115.1707742,Stays,Standard Hotel,Beachside Resort,4.3,828,https://maps.google.com/?cid=16935000673725196146,,,"Rp780,079"
280,Inna Bali Heritage Hotel,"Banjar Lelangon, Jl. Veteran No.3, Dauh Puri Kaja, Kec. Denpasar Utara, Kota Denpasar, Bali 80232, Indonesia",Denpasar Utara,Denpasar,-8.6547398,115.2166078,Stays,Standard Hotel,City Hotel,4.3,1831,https://maps.google.com/?cid=3344367897917979880,,,"Rp693,000"
281,Alam Sembuwuk Resort Ubud,"Jl. Raya Pejeng Kawan, Pejeng Kaja, Kec. Tampaksiring, Kabupaten Gianyar, Bali 80551, Indonesia",Tampaksiring,Gianyar,-8.4764642,115.2873256,Stays,Standard Hotel,Countryside Resort,4,428,https://maps.google.com/?cid=615632477061998809,,,"Rp765,000"
282,The Rinaya Canggu by ecommerceloka,"Jalan Raya Canggu, Gang Leli, Tibubeneng, Kuta Utara, Tibubeneng, Badung, Kabupaten Badung, Bali 80361, Indonesia",Kuta Utara,Badung,-8.6434279,115.1553155,Stays,Premium Hotel, Villa,4,154,https://maps.google.com/?cid=7467783276651813185,,,"Rp1,544,013"
283,Hideaway Villas Bali Uluwatu by Kanaan Hospitality,"54GP+2JJ, Jl. Bangbang Bendot, Pecatu, Kec. Kuta Sel., Kabupaten Badung, Bali 80361, Indonesia",Kuta Selatan,Badung,-8.8249692,115.1364794,Stays,Premium Hotel, Villa,4.3,577,https://maps.google.com/?cid=6632821523862593953,,,"Rp3,438,000"
284,Melasti Kuta Bungalows and Spa,"Kuta, Badung, Bali, Indonesia",Kuta,Badung,-8.7264137,115.1700855,Stays,Standard Hotel,City Hotel,3.8,669,https://maps.google.com/?cid=13588249534683879264,,,"Rp850,000"
285,Serela Legian by KAGUM Hotels,"Jl. Lb. Bene No.168, Legian, Kec. Kuta, Kabupaten Badung, Bali 80361, Indonesia",Kuta,Badung,-8.709521,115.1699877,Stays,Budget Hotel,City Hotel,4.1,999,https://maps.google.com/?cid=1965037235295072507,,,"Rp454,500"
286,Villa Harmony Residence,"85G2+V72, Gg. Merpati, Seminyak, Kec. Kuta Utara, Kabupaten Badung, Bali 80361, Indonesia",Kuta Utara,Badung,-8.6728732,115.1506435,Stays,Premium Hotel, Villa,4.3,127,https://maps.google.com/?cid=2231444063939094109,,,"Rp2,940,000"
287,Bali Sandy Resort,"Jl. Pantai Kuta Jl. Poppies Lane II, Kuta, Kec. Kuta, Kabupaten Badung, Bali 80361, Indonesia",Kuta,Badung,-8.7179913,115.1712723,Stays,Standard Hotel,City Hotel,3.8,682,https://maps.google.com/?cid=102925602853707541,,,"Rp1,109,822"
288,Wirton Seminyak Boutique Hotel,"Jl. Bidadari I No. 38, Padangsambian Klod, Kec. Denpasar Bar., Kota Denpasar, Bali 80361, Indonesia",Denpasar Barat,Denpasar,-8.6830138,115.1743753,Stays,Budget Hotel,City Hotel,4.3,116,https://maps.google.com/?cid=13306495448245614417,,,"Rp468,000"
289,Adi Assri Beach Resort & Spa,"Jl. Seririt-Gilimanuk, Pemuteran, Kec. Gerokgak, Kabupaten Buleleng, Bali 81155, Indonesia",Gerokgak,Buleleng,-8.1448124,114.6600837,Stays,Standard Hotel,Beachside Resort,4.3,931,https://maps.google.com/?cid=13418635446810890005,,,"Rp799,077"
290,Goya Boutique Resort,"Jl. Bisma, Ubud, Kecamatan Ubud, Kabupaten Gianyar, Bali 80571, Indonesia",Ubud,Gianyar,-8.51202,115.2581302,Stays,High End Hotel,Countryside Resort,4.7,563,https://maps.google.com/?cid=4058011072951319584,,,"Rp6,850,994"
291,Mahagiri Resort Nusa Lembongan,"Banjar Kaja Desa Jungutbatu, Nusa Lembongan, Kec. Nusa Penida, Kabupaten Klungkung, Bali 80771, Indonesia",Banjar,Klungkung,-8.6636389,115.4518255,Stays,Standard Hotel,Beachside Resort,4.2,1533,https://maps.google.com/?cid=3369966912384311280,,,"Rp1,099,156"
292,Yucca Villas,"Gang Ruang II Jl. Dalem Gede, Pererenan, Kec. Mengwi, Kabupaten Badung, Bali 80351, Indonesia",Mengwi,Badung,-8.6398112,115.1323115,Stays,High End Hotel,Boutique Villa,4.9,44,https://maps.google.com/?cid=17130926840709208674,,,"Rp5,750,000"
293,Grand La Walon Hotel,"Jl. Benesari, Legian, Kec. Kuta, Kabupaten Badung, Bali 80361, Indonesia",Kuta,Badung,-8.7121755,115.171791,Stays,Standard Hotel,City Hotel,4.4,681,https://maps.google.com/?cid=3956500986514822105,,,"Rp630,000"
294,Beautiful Bali Villas,"Jl. Padma Tim. No.16, Legian, Kec. Kuta, Kabupaten Badung, Bali 80361, Indonesia",Kuta,Badung,-8.7048449,115.1729736,Stays,Premium Hotel,Villa,4.6,339,https://maps.google.com/?cid=12902868439481222506,,,"Rp3,120,300"
295,Bali Rani Hotel,"Jl. Kartika Plaza, Kuta, Kec. Kuta, Kabupaten Badung, Bali 80361, Indonesia",Kuta,Badung,-8.729989,115.168206,Stays,Premium Hotel,City Hotel,4.3,1314,https://maps.google.com/?cid=17814076377742355087,,,"Rp2,250,000"
296,Lasanti Villas and Spa Seminyak,"Jl. Nakula Gg. Baik-Baik No.89, Seminyak, Kec. Kuta, Kabupaten Badung, Bali 80361, Indonesia",Kuta,Badung,-8.6950435,115.172409,Stays,Premium Hotel,Villa,4.5,284,https://maps.google.com/?cid=12812148807813053642,,,"Rp2,936,000"
297,Kuta Central Park Hotel,"Jl. Patih Jelantik, Kuta, Badung, Kabupaten Badung, Bali 80361, Indonesia",Kuta,Badung,-8.7103142,115.1793693,Stays,Premium Hotel,City Hotel,4.2,4176,https://maps.google.com/?cid=2599231124543518081,,,"Rp1,794,000"
298,Ubud Hills Villa and Resort,"Banjar Dukuh, Ubud, Tegallalang, Gianyar, Bali 80561, Indonesia",Tegallalang,Gianyar,-8.4657406,115.2793788,Stays,Premium Hotel,Countryside Resort,4,63,https://maps.google.com/?cid=10933637569063912028,,,"Rp4,440,000"
299,Nusa Majesty,"Jl. Nusa Indah No.53, Kutampi Kaler, Kec. Nusa Penida, Kabupaten Klungkung, Bali 80771, Indonesia",Nusa Penida,Klungkung,-8.674109,115.5505722,Stays,Standard Hotel,Villa,4.2,102,https://maps.google.com/?cid=2542049320129017903,,,"Rp625,500"
301,Coco De Heaven,"Jl. Bypass Ngurah Rai No.17X, Kedonganan, Kec. Kuta Sel., Kabupaten Badung, Bali 80361, Indonesia",Kuta Selatan,Badung,-8.7586198,115.1793783,Stays,Budget Hotel,Villa,3.8,877,https://maps.google.com/?cid=6704186373661473778,,,"Rp450,000"
302,Adiwana Dara Ayu Villas,"JL. Raya Buahan, No. 88X, Majangan, Buahan Kaja, Kec. Payangan, Kabupaten Gianyar, Bali 80572, Indonesia",Payangan,Gianyar,-8.3614706,115.2437193,Stays,Premium Hotel,Countryside Resort,4.4,266,https://maps.google.com/?cid=5306863783040849378,,,"Rp3,820,431"
303,The Magani Hotel and Spa,"Jl. Melasti, Legian, Kelod, Kabupaten Badung, Bali 80361, Indonesia",Kuta,Badung,-8.7087193,115.1700734,Stays,Standard Hotel,City Hotel,4.5,881,https://maps.google.com/?cid=3623221103383772173,,,"Rp1,455,345"
304,Bayad Ubud Bali Villa,"Banjar Bayad, Melinggih Kelod, Kec. Payangan, Kabupaten Gianyar, Bali 80572, Indonesia",Payangan,Gianyar,-8.4482429,115.242868,Stays,Premium Hotel,Countryside Villa,4.2,167,https://maps.google.com/?cid=11751617700986509993,,,"Rp1,773,334"
305,Kubu GWK Resort,"Jl. Raya Uluwatu No.111, Jimbaran, Kec. Kuta Sel., Kabupaten Badung, Bali 80361, Indonesia",Kuta Selatan,Badung,-8.7962369,115.1635877,Stays,Premium Hotel,Villa,4.4,181,https://maps.google.com/?cid=11570169164696080864,,,"Rp1,755,000"
306,"The Lokha Ubud Resort, Villas & Spa","Br, Jl. Bangkiang Sidem Desa, Keliki, Kec. Tegallalang, Kabupaten Gianyar, Bali 80571, Indonesia",Tegallalang,Gianyar,-8.4923642,115.2587863,Stays,Premium Hotel,Countryside Resort,4.5,1118,https://maps.google.com/?cid=2284712730952401756,,,"Rp1,681,569"
307,Wina Holiday Villa Kuta Bali,"Jl. Pantai Kuta, Kuta, Kec. Kuta, Kabupaten Badung, Bali, Indonesia",Kuta,Badung,-8.7149747,115.1699592,Stays,Standard Hotel,Villa,4.3,1042,https://maps.google.com/?cid=5883833865493598653,,,"Rp917,563"
308,Gending Kedis Luxury Villas & Spa Estate,"Jl. Karang Mas No.100X, Jimbaran, Kec. Kuta Sel., Kabupaten Badung, Bali 80361, Indonesia",Kuta Selatan,Badung,-8.7888501,115.1554159,Stays,Luxury Hotel,Villa,4.5,279,https://maps.google.com/?cid=1207838459867805862,,,"Rp11,340,000"
309,Plagoo Holiday Hotel,"Jalan Dalem Tarukan No. 7 Taman Mumbul Nusa Dua, Benoa, Kec. Kuta Sel., Kabupaten Badung, Bali 80361, Indonesia",Kuta Selatan,Badung,-8.7972902,115.2060304,Stays,Standard Hotel,City Hotel,4.3,1495,https://maps.google.com/?cid=10512381379793563000,,,"Rp669,031"
310,Nesa Sanur,"Jl. Danau Tamblingan No.144, Sanur, Denpasar Selatan, Kota Denpasar, Bali, Indonesia",Denpasar Selatan,Denpasar,-8.6960571,115.2635212,Stays,Standard Hotel,City Hotel,4.3,222,https://maps.google.com/?cid=8550697704733965628,,,"Rp710,285"
311,Hotel Sorga Cottages Kuta,"Jl. Poppies 1, Gg. Sorga No.22, Kuta, Kec. Kuta, Kabupaten Badung, Bali 80361, Indonesia",Kuta,Badung,-8.7183747,115.1718543,Stays,Budget Hotel,City Hotel,4,275,https://maps.google.com/?cid=14834575389662758151,,,"Rp238,621"
312,Argya Santi Resort,"Jl. Jepun No.1, Jimbaran, Kec. Kuta Sel., Kabupaten Badung, Bali 80361, Indonesia",Kuta Selatan,Badung,-8.7953939,115.1469269,Stays,Standard Hotel,City Hotel,4.4,372,https://maps.google.com/?cid=13299761808059629792,,,"Rp660,000"
313,The Diana Suite Hotel,"Jl. Puri Gerenceng No.46B, Tuban, Kec. Kuta, Kabupaten Badung, Bali 80361, Indonesia",Kuta,Badung,-8.7400753,115.1715732,Stays,Standard Hotel,Villa,4.3,545,https://maps.google.com/?cid=16872836022247983972,,,"Rp710,775"
314,Rantun's Place,"56F8+QCV, Jl. Raya Nusa Dua Selatan Jl. Nusa Dua, Benoa, Kec. Kuta Sel., Kabupaten Badung, Bali 80361, Indonesia",Kuta Selatan,Badung,-8.8255528,115.2159523,Stays,Standard Hotel,Villa,4.2,202,https://maps.google.com/?cid=867933859721467254,,,"Rp836,104"
315,Tropico Jimbaran Bali,"Jl. Goa Gong No.123, Jimbaran, Kec. Kuta Sel., Kabupaten Badung, Bali 80361, Indonesia",Kuta,Badung,-8.8042154,115.1780319,Stays,Budget Hotel,City Hotel,4.4,310,https://maps.google.com/?cid=7461068609845361376,,,"Rp323,760"
316,Gana Hotel & Restaurant,"Jl. Raya Pengosekan Ubud, Ubud, Kecamatan Ubud, Kabupaten Gianyar, Bali 80571, Indonesia",Ubud,Gianyar,-8.5231191,115.263134,Stays,Standard Hotel,Countryside Hotel,4.5,179,https://maps.google.com/?cid=11815575614343833904,,,"Rp1,260,000"
317,Peppers Seminyak,"Jl. Pura Telaga Waja, Kerobokan Kelod, Kec. Kuta Utara, Kabupaten Badung, Bali, Indonesia",Kuta Utara,Badung,-8.6812696,115.1544226,Stays,Luxury Hotel,Boutique Villa,4.7,1134,https://maps.google.com/?cid=16096512304014346225,,,"Rp15,246,000"
318,Taman Harum Cottages,"Jl. Raya Mas, MAS, Kecamatan Ubud, Kabupaten Gianyar, Bali 80571, Indonesia",Ubud,Gianyar,-8.5497784,115.2727014,Stays,Premium Hotel,Countryside Villa,4.4,189,https://maps.google.com/?cid=16065715552693688250,,,"Rp1,759,500"
319,Mutiara Bali Boutique Resort Villas and Spa,"Jalan Braban No.77 Seminyak, Jl. Braban, Kerobokan Kelod, Kec. Kuta Utara, Kabupaten Badung, Bali 80361, Indonesia",Kuta Utara,Badung,-8.6822953,115.1590096,Stays,Premium Hotel,Boutique Villa,4.5,460,https://maps.google.com/?cid=12596561633618217503,,,"Rp1,811,350"
320,OYO 1200 Kencana Residence,"Jl. Danau Tamblingan IV No.5, Jimbaran, Kec. Kuta Sel., Kabupaten Badung, Bali 80361, Indonesia",Kuta Selatan,Badung,-8.7899647,115.18651,Stays,Budget Hotel,City Hotel,4.3,104,https://maps.google.com/?cid=7830597195614958848,,,"Rp257,643"
321,The Hill Ungasan Bukit Jimbaran,"Jl. Raya Uluwatu, Ungasan, Kec. Kuta Sel., Kabupaten Badung, Bali 80361, Indonesia",Kuta Selatan,Badung,-8.8126885,115.1578457,Stays,Standard Hotel,City Hotel,3.9,231,https://maps.google.com/?cid=11970896954869359406,,,"Rp630,000"
322,Karang Lila Bhuana Ubud,"G7F9+RC9, Jl. Suweta, Ubud, Kecamatan Ubud, Kabupaten Gianyar, Bali 80571, Indonesia",Ubud,Gianyar,-8.4755007,115.2685592,Stays,Standard Hotel,Countryside Villa,4.6,46,https://maps.google.com/?cid=13211594877272549521,,,"Rp682,521"
323,The Alantara Sanur,"Jl. Tirta Ening No.12, Sanur Kauh, Denpasar Selatan, Kota Denpasar, Bali, Indonesia",Denpasar Selatan,Denpasar,-8.7024469,115.2560959,Stays,Standard Hotel,City Hotel,4.6,850,https://maps.google.com/?cid=11295930074577623350,,,"Rp1,362,060"
324,Destiny Boutique Hotel,"Jl. Drupadi No.10, Seminyak, Kec. Kuta, Kabupaten Badung, Bali 80361, Indonesia",Kuta,Badung,-8.6897435,115.1620177,Stays,Standard Hotel,City Hotel,4,390,https://maps.google.com/?cid=13409485346232851270,,,"Rp1,449,459"
325,Kuwarasan A Pramana Experience,"Jalan Cinta, Tegallalang, Kec. Tegallalang, Kabupaten Gianyar, Bali 80561, Indonesia",Tegallalang,Gianyar,-8.4634266,115.271981,Stays,Premium Hotel,Countryside Resort,4.8,803,https://maps.google.com/?cid=2251665496797643921,,,"Rp2,439,000"
326,OYO 2184 Nan Berlian Inn,"Near Kuta Beach, Legian, Kec. Kuta, Kabupaten Badung, Bali, Indonesia",Kuta,Badung,-8.714154,115.1720106,Stays,Budget Hotel,City Hotel,2.8,63,https://maps.google.com/?cid=12045428602927915304,,,"Rp228,042"
327,Tanadewa Resort & Spa Ubud,"Jl. Padang Getas, Singakerta, Kecamatan Ubud, Kabupaten Gianyar, Bali 80571, Indonesia",Ubud,Gianyar,-8.5441172,115.2504635,Stays,Premium Hotel,Countryside Resort,4.8,918,https://maps.google.com/?cid=17982210020052815479,,,"Rp3,972,152"
328,Dinara Ubud,"Jl. Sri Wedari No.58, Ubud, Kecamatan Ubud, Kabupaten Gianyar, Bali 80571, Indonesia",Ubud,Gianyar,-8.4847732,115.2670046,Stays,Premium Hotel,Countryside Villa,4.9,274,https://maps.google.com/?cid=17426731782870662888,,,"Rp2,923,044"
329,Samuh Ocean Sunset Hotel by WizZeLa,"Banjar Anyar, Dusun Sebunibus 80771, Sakti, Nusa Penida, Klungkung, Bali, Indonesia",Banjar,Klungkung,-8.6848705,115.4820719,Stays,Standard Hotel,Beachside Hotel,3.8,32,https://maps.google.com/?cid=3325718448034669906,,,"Rp1,099,687"
330,Omatha Village,"Jl. Kembang Matahari I No.110b, Sumerta, Kec. Denpasar Tim., Kota Denpasar, Bali 80236, Indonesia",Nusa Penida,Klungkung,-8.6513094,115.2391008,Stays,Standard Hotel,Villa,4.4,214,https://maps.google.com/?cid=14864011264630734459,,,"Rp612,000"
331,The Awan Villas,"Jl. Batu Belig No.168, Seminyak, Kec. Kuta Utara, Kabupaten Badung, Bali 80361, Indonesia",Kuta Utara,Badung,-8.6729969,115.1530503,Stays,Premium Hotel,Villa,4.4,172,https://maps.google.com/?cid=3705050212968977650,,,"Rp4,652,458"
332,Alam Kulkul Boutique Resort,"Jl. Pantai Kuta, Legian, Kec. Kuta, Kabupaten Badung, Bali 80361, Indonesia",Kuta,Badung,-8.7107976,115.1672455,Stays,Premium Hotel,Boutique Villa,4.4,933,https://maps.google.com/?cid=13854234124350920633,,,"Rp1,783,710"
333,"Abian Srama Hotel, Massage And Spa","Jl. Bypass Ngurah Rai No.23, Sanur, Denpasar Selatan, Kota Denpasar, Bali 80228, Indonesia",Denpasar Selatan,Denpasar,-8.6848888,115.2593765,Stays,Budget Hotel,City Hotel,3.5,621,https://maps.google.com/?cid=8484693093052758770,,,"Rp173,333"
334,Astagina Resort Villa and Spa,"Astagina Resort Villa and Spa Bali, Gg. Bulan No.8, Legian, Kec. Kuta, Kabupaten Badung, Bali 80361, Indonesia",Kuta,Badung,-8.697961,115.1663204,Stays,Premium Hotel,Villa,4.4,1361,https://maps.google.com/?cid=7069567761319392302,,,"Rp3,402,936"
335,Pondok Anyar Hotel,"Jl. Kubu Anyar Gg. kingkong I No.1, Kuta, Kec. Kuta, Kabupaten Badung, Bali 80361, Indonesia",Kuta,Badung,-8.7313757,115.1707302,Stays,Standard Hotel,City Hotel,4.1,439,https://maps.google.com/?cid=9737921043337852447,,,"Rp517,500"
336,"FuramaXclusive Resort & Villas, Ubud","Jl. Raya Mambal Banjar Bindu, Mambal, Mekar Bhuwana, Kec. Abiansemal, Kabupaten Badung, Bali 80571, Indonesia",Ubud,Gianyar,-8.5433959,115.2313933,Stays,Standard Hotel,Countryside Villa,4.5,1169,https://maps.google.com/?cid=7103709964791072505,,,"Rp1,350,000"
337,Nata Ubud,"Jl. Suweta, Banjar Bentuyung, Kecamatan Ubud, Kabupaten Gianyar, Bali 80571, Indonesia",Ubud,Gianyar,-8.4841554,115.2653995,Stays,Standard Hotel,Countryside Villa,4.6,99,https://maps.google.com/?cid=9914087379522729703,,,"Rp1,440,000"
338,The Bandha Hotel & Suites,"Jl. Padma Utara Jl. Raya Legian, Legian, Kec. Kuta, Kabupaten Badung, Bali 80361, Indonesia",Kuta,Badung,-8.7020194,115.1655976,Stays,High End Hotel,City Hotel,4.6,905,https://maps.google.com/?cid=1391164046207488074,,,"Rp5,687,147"
339,Hotel Terrace at Kuta,"Jl. Benesari No.2, Kuta, Kec. Kuta, Kabupaten Badung, Bali 80361, Indonesia",Kuta,Badung,-8.712399,115.172231,Stays,Standard Hotel,City Hotel,4.3,834,https://maps.google.com/?cid=9756327234239300950,,,"Rp757,052"
340,Dedary Resort Ubud,"Banjar Pinjul No.8, Kenderan, Kec. Tegallalang, Kabupaten Gianyar, Bali 80571, Indonesia",Tegallalang,Gianyar,-8.4580507,115.2853009,Stays,Premium Hotel,Countryside Resort,4.8,695,https://maps.google.com/?cid=5281155773453145187,,,"Rp2,400,000"
341,Adelia Residence,"86W2+PC4, Gg. IV, Pemecutan, Kec. Denpasar Bar., Kota Denpasar, Bali 80111, Indonesia",Denpasar Barat,Denpasar,-8.6532432,115.2010898,Stays,Budget Hotel,City Hotel,2.8,78,https://maps.google.com/?cid=3048579864476069289,,,"Rp121,021"
342,La Berceuse Resort and Villa Nusa Dua by Taritiya Collection,"Jl. Desa Sawangan Jl. Nusa Dua, Benoa, Kec. Kuta Sel., Kabupaten Badung, Bali 80361, Indonesia",Kuta Selatan,Badung,-8.8182969,115.2142087,Stays,Premium Hotel,Villa,4.6,396,https://maps.google.com/?cid=14175581608340756001,,,"Rp2,153,844"
343,Kutus Kutus Mas Ubud Villa,"Banjar Kumbuh, Jl. Cempaka, MAS, Kecamatan Ubud, Kabupaten Gianyar, Bali 80571, Indonesia",Ubud,Gianyar,-8.535896,115.2664384,Stays,Standard Hotel,Countryside Villa,4.7,90,https://maps.google.com/?cid=15474648168671309544,,,"Rp1,098,000"
344,Aniniraka Resort And Spa,"Jl. Raya Tjampuhan, Sanggingan, Ubud, Sayan, Kec. Gianyar, Kabupaten Gianyar, Bali 80571, Indonesia",Gianyar,Gianyar,-8.4982642,115.2530118,Stays,Standard Hotel,Countryside Resort,4.2,266,https://maps.google.com/?cid=14083564077618361001,,,"Rp835,248"
345,Vico Hotel,"Jl. Pratama Gg. Bidadari No.81, Nusa dua, Kec. Kuta Sel., Kabupaten Badung, Bali 80361, Indonesia",Kuta Selatan,Badung,-8.7746288,115.2216152,Stays,Budget Hotel,Villa,3.7,178,https://maps.google.com/?cid=16644721161126413982,,,"Rp178,860"
346,Segara Sadhu Inn Kuta,"Jl. Poppies II Gg I No.3, Kuta, Kec. Kuta, Kabupaten Badung, Bali 80361, Indonesia",Kuta,Badung,-8.717959,115.1704557,Stays,Budget Hotel,Villa,3.5,193,https://maps.google.com/?cid=15128197225037058471,,,"Rp270,000"
347,SenS Hotel and Spa,"Jl. Sukma Kesuma No.1, Banjar Tebesaya, Kecamatan Ubud, Kabupaten Gianyar, Bali 80571, Indonesia",Ubud,Gianyar,-8.5096596,115.2688806,Stays,Premium Hotel,City Hotel,4.4,931,https://maps.google.com/?cid=2579282934551478891,,,"Rp1,913,151"
348,Atta Mesari Ubud,"Jl. Suweta, Ubud, Kecamatan Ubud, Kabupaten Gianyar, Bali 80571, Indonesia",Ubud,Gianyar,-8.4920601,115.2655167,Stays,Premium Hotel,Countryside Villa,4.6,428,https://maps.google.com/?cid=9015920287140369980,,,"Rp3,285,799"
349,Anja Jimbaran,"Jl. Yoga Perkanthi No.2, Jimbaran, Kec. Kuta Sel., Kabupaten Badung, Bali 80361, Indonesia",Kuta Selatan,Badung,-8.7723075,115.1699793,Stays,Premium Hotel,City Hotel,4.5,412,https://maps.google.com/?cid=847192335598231166,,,"Rp1,850,980"
350,The Pari Sudha,"Jl. Raya Petulu No.Br, Petulu, Kecamatan Ubud, Kabupaten Gianyar, Bali 80571, Indonesia",Ubud,Gianyar,-8.491333,115.2731825,Stays,Premium Hotel,Countryside Hotel,4.3,161,https://maps.google.com/?cid=2955730952749319968,,,"Rp1,554,798"
351,Natya Tanah Lot,"Jl. Kawasan Wisata Tanah Lot, Beraban, Kediri, Beraban, Kediri, Beraban, Kec. Kediri, Kabupaten Tabanan, Bali 82171, Indonesia",Kediri,Tabanan,-8.6186856,115.0882668,Stays,Premium Hotel,City Hotel,4.6,551,https://maps.google.com/?cid=6715371307069250783,,,"Rp1,826,532"
352,Tira Vilagna Suites & Spa,"Jalan Shanti, Padang Mun, Kec. Kintamani, Kabupaten Bangli, Bali 80652, Indonesia",Kintamani,Bangli,-8.2600874,115.3337451,Stays,High End Hotel,Countryside Villa,4.7,305,https://maps.google.com/?cid=2890353846294546550,,,"Rp7,830,000"
353,The Niche Bali,"Jl. Raya Legian No.190, Kuta, Kec. Kuta, Kabupaten Badung, Bali 80361, Indonesia",Kuta,Badung,-8.7161977,115.1743127,Stays,Budget Hotel,City Hotel,4.2,211,https://maps.google.com/?cid=10035227692498810574,,,"Rp440,000"
354,Samana Residence Denpasar,"Jalan Ciung Wanara II No. 29, Sumerta Kelod, Renon, Denpasar Selatan, Denpasar City, Bali 80226, Indonesia",Denpasar Selatan,Denpasar,-8.6747157,115.2367475,Stays,Budget Hotel,City Hotel,4.3,150,https://maps.google.com/?cid=6688258183978398715,,,"Rp390,000"
355,The Akasha Boutique Hotel,"Seminyak, Jl. Batu Belig No.999AB, Kerobokan Kelod, Kec. Kuta Utara, Kabupaten Badung, Bali 80361, Indonesia",Kuta Utara,Badung,-8.672983,115.146849,Stays,Premium Hotel,Boutique Villa,4.6,195,https://maps.google.com/?cid=235783146308786592,,,"Rp3,291,861"
356,Fourteen Roses Boutique Hotel Kuta,"Jl. Raya Legian No.153, Kuta, Kec. Kuta, Kabupaten Badung, Bali 80361, Indonesia",Kuta,Badung,-8.7138287,115.1732258,Stays,Standard Hotel,City Hotel,4.2,586,https://maps.google.com/?cid=7420356068533580198,,,"Rp810,000"
357,The Tiing Tejakula Villas,"Br. Tegal Sumaga, Les, Kec. Tejakula, Kabupaten Buleleng, Bali 81173, Indonesia",Tejakula,Buleleng,-8.1292773,115.361859,Stays,Premium Hotel,Beachside Resort,4.7,242,https://maps.google.com/?cid=4661777728655738856,,,"Rp1,951,200"
358,Sunrise Hotel Sanur,"Jl. Bypass Ngurah Rai No.115, Sanur, Denpasar Selatan, Kota Denpasar, Bali 80227, Indonesia",Denpasar Selatan,Denpasar,-8.683831,115.2592457,Stays,Budget Hotel,City Hotel,4,216,https://maps.google.com/?cid=4689374612433843685,,,"Rp378,000"
359,M BOX SEMINYAK,"Jl. Raya Seminyak No.19, Seminyak, Kec. Kuta, Kabupaten Badung, Bali 80361, Indonesia",Kuta,Badung,-8.6945122,115.1681054,Stays,Budget Hotel,City Hotel,4.1,233,https://maps.google.com/?cid=11869065423073539205,,,"Rp133,333"
360,OYO 1670 Likko Inn,"Jl. Suli No.11, Dangin Puri Kangin, Kec. Denpasar Utara, Kota Denpasar, Bali 80234, Indonesia",Denpasar Utara,Denpasar,-8.6480181,115.2229098,Stays,Budget Hotel,City Hotel,4,345,https://maps.google.com/?cid=7578673514354553280,,,"Rp282,831"
361,Avani Seminyak Bali Resort,"Jl. Drupadi No.28, Seminyak, Kec. Kuta, Kabupaten Badung, Bali 80361, Indonesia",Kuta,Badung,-8.688091,115.1640917,Stays,Premium Hotel,Boutique Villa,4.7,398,https://maps.google.com/?cid=6347501860222467123,,,"Rp2,747,959"
362,Yulia Beach Inn Kuta,"Jalan Pantai Kuta, Banjar Pande Mas No.43, Kuta, Kec. Kuta, Kabupaten Badung, Bali 80361, Indonesia",Kuta,Badung,-8.7227621,115.1719023,Stays,Standard Hotel,Villa,4.2,342,https://maps.google.com/?cid=437646541904829947,,,"Rp994,500"
363,Chillin Kuta Homestay,"Jl. Polonia I No.25X, Tuban, Kec. Kuta, Kabupaten Badung, Bali 80361, Indonesia",Kuta,Badung,-8.7416082,115.1687299,Stays,Budget Hotel,City Hotel,3.6,159,https://maps.google.com/?cid=1801227647900414636,,,"Rp215,552"
364,Villa Puri Ayu,"Jl. Cemara No.4D, Sanur Kauh, Denpasar Selatan, Kota Denpasar, Bali, Indonesia",Denpasar Selatan,Denpasar,-8.7082634,115.2571516,Stays,Standard Hotel,Villa,4.3,134,https://maps.google.com/?cid=10060118253657277542,,,"Rp983,367"
365,The Nani,"Jl. Sri Wedari, Ubud, Kecamatan Ubud, Kabupaten Gianyar, Bali 80572, Indonesia",Ubud,Gianyar,-8.4771817,115.2686311,Stays,Premium Hotel,Countryside Hotel,4.6,167,https://maps.google.com/?cid=16957540987964919708,,,"Rp1,668,000"
366,Nirmala Hotel Jimbaran,"Jl. Uluwatu II No.10, Jimbaran, Kec. Kuta Sel., Kabupaten Badung, Bali 80361, Indonesia",Kuta Selatan,Badung,-8.7817772,115.1742643,Stays,Standard Hotel,City Hotel,3.8,754,https://maps.google.com/?cid=2808268456472575362,,,"Rp554,400"
367,Zest Legian by Swiss-Belhotel International,"Jl. Werkudara No.525, Legian, Kec. Kuta, Kabupaten Badung, Bali 80361, Indonesia",Kuta,Badung,-8.700064,115.165934,Stays,Standard Hotel,City Hotel,4.5,884,https://maps.google.com/?cid=13517197530669743325,,,"Rp606,667"
368,Airis Luxury Villas & Spa,"549V+WCM, Jl. Raya Uluwatu No.Km. 23, Ungasan, Kec. Kuta Sel., Kabupaten Badung, Bali 80361, Indonesia",Kuta Selatan,Badung,-8.8304897,115.144085,Stays,Premium Hotel,Villa,4.2,172,https://maps.google.com/?cid=16516317407447295923,,,"Rp2,600,000"
369,Alindra Villa,"Jl. Bypass Ngurah Rai Jl. Aneka Warga No.12, Jimbaran, Kec. Kuta Sel., Kabupaten Badung, Bali 80363, Indonesia",Kuta Selatan,Badung,-8.7867063,115.1917442,Stays,Premium Hotel,Villa,4.5,927,https://maps.google.com/?cid=8753469034068116204,,,"Rp2,610,000"
