No,Destination Name,Address,Subdistrict,Regency,Latitude,Longitude,Category 1,Category 2 ,Category 3,Rating,Google Reviews (Count),Source,Child Entry,Adults Entry,Normal Hotel Price
862,Wahyu Masari Homestay Penida,"Sakti, Nusa Penida, Klungkung, Bali 80771, Indonesia",Nusa Penida,Klungkung,-8.7096439,115.4990462,Stays,Budget Hotel,City Hotel,4.7,78,https://maps.google.com/?cid=9562462644882160406,,,"Rp329,400"
863,The Banana House Nusa Penida,"Jl. Raya Klumpu - Toya Pakeh, Sakti, Kec. Nusa Penida, Kabupaten Klungkung, Bali 80771, Indonesia",Nusa Penida,Klungkung,-8.7026421,115.4895888,Stays,Budget Hotel,City Hotel,4.9,54,https://maps.google.com/?cid=9455357976381534317,,,"Rp202,500"
864,The Niti Hut's Lembongan,"Dream Beach Street Lembongan, Jungutbatu, Lembongan, Kabupaten Klungkung, Bali 80771, Indonesia",Nusa Penida,Klungkung,-8.6886604,115.4330897,Stays,Standard Hotel,Villa,4.7,105,https://maps.google.com/?cid=14522828429197270670,,,"Rp973,333"
865,Ubud Sari Health Resort,"Jl. Kajeng No.35, Ubud, Kecamatan Ubud, Kabupaten Gianyar, Bali 80571, Indonesia",Ubud,Gianyar,-8.5023697,115.2628275,Stays,Standard Hotel,Countryside Resort,4.3,158,https://maps.google.com/?cid=2723291009367771839,,,"Rp895,691"
866,Bale Bali House,"Jl. Sugriwa, Padang Tegal, Kecamatan Ubud, Kabupaten Gianyar, Bali 80571, Indonesia",Ubud,Gianyar,-8.5158688,115.2647663,Stays,Budget Hotel,Countryside Villa,4.7,88,https://maps.google.com/?cid=14975800756517749709,,,"Rp260,000"
867,Kondra Premiere Guest House,"Jl. Benesari Gg. Arjuna No.1, Kuta, Kec. Kuta, Kabupaten Badung, Bali 80361, Indonesia",Kuta,Badung,-8.712766,115.171104,Stays,Standard Hotel,City Hotel,4.4,129,https://maps.google.com/?cid=8960522690976173283,,,"Rp724,104"
868,Kememai Hostel,"Jl. Nyuh Gading No.1, MAS, Kecamatan Ubud, Kabupaten Gianyar, Bali 80571, Indonesia",Ubud,Gianyar,-8.5246072,115.2568492,Stays,Budget Hotel,Countryside Hotel,4.2,78,https://maps.google.com/?cid=7512165068977461266,,,"Rp138,155"
869,Taxa Uma,"Jl. Tegal Wangi No.18, Kuta, Kec. Kuta, Kabupaten Badung, Bali 80361, Indonesia",Kuta,Badung,-8.7236828,115.1733832,Stays,Budget Hotel,City Hotel,3.9,113,https://maps.google.com/?cid=7268119715324273138,,,"Rp295,380"
870,THE AYUDYA PURA DEMAK,"Jl. Pura Demak No.27, Pemecutan Klod, Kec. Denpasar Bar., Kota Denpasar, Bali 80119, Indonesia",Denpasar Barat,Denpasar,-8.6798541,115.193287,Stays,Budget Hotel,City Hotel,4.6,76,https://maps.google.com/?cid=6010368006729780630,,,"Rp266,667"
871,The Ocean Sunset Villas Ceningan,"7CVQ+WV4, Pulau Ceningan, Lembongan, Klungkung, Kabupaten Klungkung, Bali 80771, Indonesia",Nusa Penida,Klungkung,-8.7052296,115.439697,Stays,Standard Hotel,Villa,4.2,94,https://maps.google.com/?cid=11599997680929743429,,,"Rp733,332"
872,The Nicho's Bungalows & Villas,"Mushroom Beach Nusa Lembongan Jungutbatu, Jungutbatu, Kec. Nusa Penida, Kabupaten Klungkung, Bali 80771, Indonesia",Nusa Penida,Klungkung,-8.6838016,115.4338671,Stays,Budget Hotel,Villa,3.4,67,https://maps.google.com/?cid=3253471707451019369,,,"Rp346,962"
873,Gedhong Hostel,"Kutampi Kaler, Nusa Penida, Klungkung, Bali 80771, Indonesia",Nusa Penida,Klungkung,-8.6751474,115.5488029,Stays,Budget Hotel,City Hotel,4.7,110,https://maps.google.com/?cid=1340741108060857684,,,"Rp230,557"
874,Hotel Mawar II Denpasar,"JL. Mayjen Sutoyo No.16, Banjar Gemeh, Denpasar Barat - Bali 80114, Dauh Puri Kangin, Kec. Denpasar Bar., Kota Denpasar, Bali 80232, Indonesia",Denpasar Barat,Denpasar,-8.659624,115.216556,Stays,Budget Hotel,City Hotel,3.6,68,https://maps.google.com/?cid=7572504433193348254,,,"Rp216,600"
875,Cool Breeze Bungalow Nusa Penida,"8GC8+6PR, Jalan, Buyuk, Ped, Kec. Nusa Penida, Kabupaten Klungkung, Bali 80771, Indonesia",Nusa Penida,Klungkung,-8.6793907,115.5167792,Stays,Budget Hotel,Villa,3.8,12,https://maps.google.com/?cid=964253001978363079,,,"Rp337,500"
876,Mekar Jaya Bungalows,"Jl. Benesari No.6, Kuta, Kec. Kuta, Kabupaten Badung, Bali 80361, Indonesia",Kuta,Badung,-8.7141725,115.1720931,Stays,Budget Hotel,City Hotel,4.3,119,https://maps.google.com/?cid=18436297598452547303,,,"Rp202,667"
877,Van Santri Homestay Pemuteran,"Pemuteran, Gerokgak, Buleleng, Bali 81155, Indonesia",Gerokgak,Buleleng,-8.1490761,114.6604278,Stays,Budget Hotel,Countryside Hotel,4.8,37,https://maps.google.com/?cid=16940630127880025273,,,"Rp173,333"
878,LaGriya Guest House,"Jl. Gemitir No.45, Kesiman Kertalangu, Kec. Denpasar Tim., Kota Denpasar, Bali 80237, Indonesia",Denpasar Timur,Denpasar,-8.6426997,115.2644961,Stays,Standard Hotel,City Hotel,4.6,48,https://maps.google.com/?cid=11728984552598685057,,,"Rp637,500"
879,Putri Homestay,"Jl. Danau Tamblingan No.65, Sanur, Denpasar Selatan, Kota Denpasar, Bali 80228, Indonesia",Denpasar Selatan,Denpasar,-8.6942548,115.2638785,Stays,Standard Hotel,City Hotel,4.2,89,https://maps.google.com/?cid=17136903532523256436,,,"Rp699,999"
880,Kubu Turah Homestay,"Jalan Pasir Putih No.25 Kedonganan, Jimbaran, Kec. Kuta, Kabupaten Badung, Bali 80361, Indonesia",Kuta,Badung,-8.7607835,115.1718185,Stays,Budget Hotel,City Hotel,4.2,33,https://maps.google.com/?cid=40758375608801513,,,"Rp274,716"
881,Uma Kutuh Bungalow,"Jl. Tirta Tawar No.70, Kutuh, Kecamatan Ubud, Kabupaten Gianyar, Bali 80571, Indonesia",Ubud,Gianyar,-8.500765,115.2695883,Stays,Budget Hotel,Villa,3.3,27,https://maps.google.com/?cid=1399226348540329198,,,"Rp191,076"
882,OYO 90089 Hotel Satria Syariah,"Jl. Yudistira No.30, Dangin Puri Kauh, Kec. Denpasar Utara, Kota Denpasar, Bali 80233, Indonesia",Denpasar Utara,Denpasar,-8.6492194,115.216288,Stays,Budget Hotel,City Hotel,4.3,34,https://maps.google.com/?cid=4231242826437039493,,,"Rp129,073"
883,Buda Cottage Ubud,"Jl. Raya Laplapan, Pejeng Kawan, Kecamatan Ubud, Kabupaten Gianyar, Bali 80552, Indonesia",Ubud,Gianyar,-8.497795,115.2788221,Stays,Budget Hotel,Villa,4.7,101,https://maps.google.com/?cid=17177408683765670888,,,"Rp343,925"
884,Omah Nusa Villa,"Jl. Raya Toya Pakeh - Ped, Kp. Toyapakeh, Kec. Nusa Penida, Kabupaten Klungkung, Bali 80771, Indonesia",Nusa Penida,Klungkung,-8.6800007,115.4886692,Stays,Budget Hotel,City Hotel,4.7,35,https://maps.google.com/?cid=3706213036053521154,,,"Rp333,334"
885,Ninja Suite Villa,"Jl. Sekar Tunjung V, Kesiman Kertalangu, Kec. Denpasar Tim., Kota Denpasar, Bali 80237, Indonesia",Denpasar Timur,Denpasar,-8.6361425,115.2383188,Stays,Standard Hotel,City Hotel,4.1,54,https://maps.google.com/?cid=2514901426887428034,,,"Rp511,693"
886,Matta Lodge Bali,"Jl. Danau Batur Timur No.C/10, Jimbaran, Kec. Kuta Sel., Kabupaten Badung, Bali 80361, Indonesia",Kuta Selatan,Badung,-8.7871226,115.187678,Stays,Budget Hotel,City Hotel,4.7,50,https://maps.google.com/?cid=210012968771837096,,,"Rp228,000"
887,Bulan Bali Homestay & Hostel,"Jl. Cok Gede Rai Banjar Tengah Kauh, Gang Ante Kangin n 0.5, Peliatan, Kecamatan Ubud, Kabupaten Gianyar, Bali 90571, Indonesia",Ubud,Gianyar,-8.5200244,115.2669293,Stays,Budget Hotel,Countryside Hotel,4.2,107,https://maps.google.com/?cid=8001855465763376601,,,"Rp300,000"
888,Ramaya Ubud View by EPS,"Jl. RY Dalem, Kelusa, Kec. Tegallalang, Kabupaten Gianyar, Bali 80561, Indonesia",Tegallalang,Gianyar,-8.4477714,115.2648024,Stays,Budget Hotel,Villa,4.6,21,https://maps.google.com/?cid=16915625547336700090,,,"Rp268,920"
889,Ubud Canti Accommodation,"Jl. A.A. Gede Rai, Lodtunduh, Kecamatan Ubud, Kabupaten Gianyar, Bali 80361, Indonesia",Ubud,Gianyar,-8.5434883,115.2621241,Stays,Budget Hotel,Villa,4.2,85,https://maps.google.com/?cid=6724135283814384177,,,"Rp266,668"
890,Eliska Sari Bungalows,"RJX8+F7C, Jalan Taman Sumberkesambi, Sumberkima, Kec. Gerokgak, Kabupaten Buleleng, Bali 81155, Indonesia",Gerokgak,Buleleng,-8.1513146,114.6156329,Stays,Budget Hotel,Villa,4.5,47,https://maps.google.com/?cid=11151548062315080416,,,"Rp276,000"
891,Bulan Bali Hostel,"Jl. Sukma Kesuma, Peliatan, Kecamatan Ubud, Kabupaten Gianyar, Bali 80571, Indonesia",Ubud,Gianyar,-8.5200244,115.2669293,Stays,Budget Hotel,Villa,4.2,107,https://maps.google.com/?cid=14938147780501735538,,,"Rp100,000"
892,Askara Guest House & Hostel,"Jl. Tirta Tawar, Kutuh Kaja, Kecamatan Ubud, Kabupaten Gianyar, Bali 80571, Indonesia",Ubud,Gianyar,-8.4998408,115.268516,Stays,Budget Hotel,Countryside Hotel,4.4,100,https://maps.google.com/?cid=13276127825171490692,,,"Rp200,000"
893,The Calna Villa Bali,"Jl. Raya Kuta No.72, Kuta, Kec. Kuta, Kabupaten Badung, Bali 80361, Indonesia",Kuta,Badung,-8.7218564,115.1797729,Stays,Premium Hotel,Villa,4.6,86,https://maps.google.com/?cid=4448483382723318368,,,"Rp2,254,792"
894,Artaloka Hotel Penida,"7F3R+7CQ, Bunga Mekar, Kec. Nusa Penida, Kabupaten Klungkung, Bali 80771, Indonesia",Nusa Penida,Klungkung,-8.736633,115.498328,Stays,Standard Hotel,City Hotel,4.3,35,https://maps.google.com/?cid=4994302075059825129,,,"Rp666,667"
895,The Calna Villa Bali,"Jl. Raya Kuta No.72, Kuta, Kec. Kuta, Kabupaten Badung, Bali 80361, Indonesia",Kuta,Badung,-8.7218564,115.1797729,Stays,Premium Hotel,Villa,4.6,86,https://maps.google.com/?cid=4448483382723318368,,,"Rp2,254,792"
896,Artaloka Hotel Penida,"7F3R+7CQ, Bunga Mekar, Kec. Nusa Penida, Kabupaten Klungkung, Bali 80771, Indonesia",Nusa Penida,Klungkung,-8.736633,115.498328,Stays,Standard Hotel,City Hotel,4.3,35,https://maps.google.com/?cid=4994302075059825129,,,"Rp666,667"
897,Delight ART Villas,"Jl. Laksmana Gg. Putu, Seminyak, Kec. Kuta, Kabupaten Badung, Bali 80361, Indonesia",Kuta,Badung,-8.6866207,115.1616506,Stays,High End Hotel,Villa,4.8,125,https://maps.google.com/?cid=18380681211412298827,,,"Rp9,684,112"
898,The Garuda Homestay Sanur,"8733+677, Jl. Tunggak Bingin, Sanur Kauh, Denpasar Selatan, Kota Denpasar, Bali 80228, Indonesia",Denpasar Selatan,Denpasar,-8.6969565,115.2531641,Stays,Budget Hotel,City Hotel,4.2,32,https://maps.google.com/?cid=6040882649700066325,,,"Rp320,000"
899,Castaway Resort Lembongan,"Mushroom Bay, Jl Mushroom Bay, Nusa, Lembongan, Kec. Nusa Penida, Kabupaten Klungkung, Bali 80771, Indonesia",Nusa Penida,Klungkung,-8.6841888,115.434651,Stays,Premium Hotel,Villa,4.6,65,https://maps.google.com/?cid=3755998650271433576,,,"Rp2,857,631"
900,"Dua Dari, a Residence by Hadiprana","Jl. Gn. Sari, Peliatan, Kecamatan Ubud, Kabupaten Gianyar, Bali 80571, Indonesia",Ubud,Gianyar,-8.5096458,115.2780745,Stays,Premium Hotel,Countryside Hotel,4.7,31,https://maps.google.com/?cid=12066677304140407839,,,"Rp3,750,000"
901,Sebuluh Sunset Hill Penida,"Unnamed Road, Bunga Mekar, Kec. Nusa Penida, Kabupaten Klungkung, Bali 80771, Indonesia",Nusa Penida,Klungkung,-8.7508697,115.4952022,Stays,Standard Hotel,Countryside Villa,4.7,53,https://maps.google.com/?cid=2794495394409792073,,,"Rp1,403,100"
902,The Bhaswara Ubud,"Jl. Dewi sri, Banjar Jl. Raya Kengetan, Singakerta, Kec. Sukawati, Kabupaten Gianyar, Bali 80571, Indonesia",Sukawati,Gianyar,-8.5509804,115.2529131,Stays,Standard Hotel,Countryside Hotel,5,1,https://maps.google.com/?cid=15041600517817229197,,,"Rp705,750"
903,The Kd Suites & Coffee Shop,"9464+HPX, Jl. Pantai Mengening, Cemagi, Kec. Mengwi, Kabupaten Badung, Bali, Indonesia",Mengwi,Badung,-8.6389576,115.1071109,Stays,Standard Hotel,City Hotel,4.8,30,https://maps.google.com/?cid=16554956491833756059,,,"Rp1,200,000"
904,Villa Paradise Uluwatu,"Jl. Taman Paradise No.3, Ungasan, Kec. Kuta Sel., Balangan - Uluwatu, Bali 80632, Indonesia",Kuta Selatan,Badung,-8.8166451,115.1482502,Stays,Luxury Hotel,Boutique Villa,5,1,https://maps.google.com/?cid=5002214455929939318,,,"Rp12,266,666"
905,Aventus Resort Ubud,"Jalan Pura Prajapati, Banjar Tangkup, Kedisan, Kec. Tegallalang, Kabupaten Gianyar, Bali 80561, Indonesia",Tegallalang,Gianyar,-8.435597,115.2822503,Stays,Standard Hotel,Countryside Resort,4.8,54,https://maps.google.com/?cid=206719848516851351,,,"Rp819,000"
906,Prayatna Villas,"Jl. Br Jasan No.16, Sebatu, Kec. Tegallalang, Kabupaten Gianyar, Bali 80561, Indonesia",Ubud,Gianyar,-8.3716998,115.3045407,Stays,Premium Hotel,Countryside Villa,5,50,https://maps.google.com/?cid=5828542594830463000,,,"Rp2,000,000"
908,"Dua Dari, a Residence by Hadiprana","Jl. Gn. Sari, Peliatan, Kecamatan Ubud, Kabupaten Gianyar, Bali 80571, Indonesia",Ubud,Gianyar,-8.5096458,115.2780745,Stays,Premium Hotel,Countryside Hotel,4.7,31,https://maps.google.com/?cid=12066677304140407839,,,"Rp3,750,000"
909,Sebuluh Sunset Hill Penida,"Unnamed Road, Bunga Mekar, Kec. Nusa Penida, Kabupaten Klungkung, Bali 80771, Indonesia",Nusa Penida,Klungkung,-8.7508697,115.4952022,Stays,Standard Hotel,Countryside Villa,4.7,53,https://maps.google.com/?cid=2794495394409792073,,,"Rp1,403,100"
910,GK Bali Resort,"Jl. Ume Kelod, Sebatu, Kec. Tegallalang, Kabupaten Gianyar, Bali 80561, Indonesia",Tegallalang,Gianyar,-8.4068514,115.2948065,Stays,Premium Hotel,Countryside Resort,4.8,179,https://maps.google.com/?cid=10105928383680391934,,,"Rp3,022,500"
911,Amala Villas Ubud,"Banjar Dinas, Jl. Raya Sebali, Keliki, Kecamatan Ubud, Kabupaten Gianyar, Bali 80571, Indonesia",Ubud,Gianyar,-8.4653685,115.2604236,Stays,Luxury Hotel,Countryside Villa,4.8,18,https://maps.google.com/?cid=4140704517988459925,,,"Rp10,694,063"
912,Danakha Villa Ubud,"Banjar Dukuh, Jl. Raya Kenderan, Tegallalang, Kec. Tegallalang, Kabupaten Gianyar, Bali 80561, Indonesia",Tegallalang,Gianyar,-8.4600293,115.281503,Stays,Premium Hotel,Countryside Villa,4.3,66,https://maps.google.com/?cid=16270662360351846999,,,"Rp3,750,000"
913,The Sagara Penida,"Jl. Batu Nunggal-Suana, Suana, Kec. Nusa Penida, Kabupaten Klungkung, Bali 80771, Indonesia",Nusa Penida,Klungkung,-8.7096715,115.5873709,Stays,Premium Hotel,Beachside Hotel,4.4,91,https://maps.google.com/?cid=6242081481691005629,,,"Rp1,866,667"
914,The Royal Santrian,"Nusa Dua, Jl. Pratama, Benoa, Kec. Kuta Sel., Kabupaten Badung, Bali 80361, Indonesia",Kuta Selatan,Badung,-8.7830688,115.225559,Stays,Luxury Hotel,Boutique Villa,4.7,1224,https://maps.google.com/?cid=5123145456773198805,,,"Rp10,585,884"
915,Kelingking Sunset Point Hotel & Spa,"Jl. Pantai Kelingking, Karang Dawa, Bunga Mekar, Kec. Nusa Penida, Kabupaten Klungkung, Bali 80771, Indonesia",Nusa Penida,Klungkung,-8.7505795,115.4765976,Stays,Standard Hotel,Beachside Hotel,4.4,227,https://maps.google.com/?cid=3372188063048383173,,,"Rp1,295,000"
916,GK Bali Resort,"Jl. Ume Kelod, Sebatu, Kec. Tegallalang, Kabupaten Gianyar, Bali 80561, Indonesia",Tegallalang,Gianyar,-8.4068514,115.2948065,Stays,Premium Hotel,Countryside Resort,4.8,179,https://maps.google.com/?cid=10105928383680391934,,,"Rp3,022,500"
917,The Sayan House,"Jl. Raya Sayan No.70, Sayan, Kecamatan Ubud, Kabupaten Gianyar, Bali 80571, Indonesia",Ubud,Gianyar,-8.4986293,115.2442719,Stays,Standard Hotel,Countryside Resort,4.6,1966,https://maps.google.com/?cid=17842996982682089517,,,"Rp20,000,000"
918,Sundari Day Spa,"Jalan Petitenget 7 Kerobokan, Seminyak, Kec. Kuta, Kabupaten Badung, Bali 80361",Kuta,Badung,-8.6718055,115.1632114,Day Spa,Massage,Balinese Spa,4.7,1800,https://g.co/kgs/Z4h4HbV,,,
919,Bodyworks Spa,"Jl. Lb. Sari Jl. Petitenget No.3, Seminyak, Kec. Kuta Utara, Kabupaten Badung, Bali 80361",Kuta Utara,Badung,-8.671471757,115.1576387,Day Spa,Hairstyling,Massage,4.4,1788,https://g.co/kgs/ZoKYNNw,,,
920,La Nusa Bali Spa,"Jl. Pratama No.35A, Benoa, Kec. Kuta Sel., Kabupaten Badung, Bali 80361",Kuta Selatan,Badung,-8.7841479,115.2251694,Day Spa,Massage,Balinese Spa,4.9,1878,https://g.co/kgs/Syq3Gft,,,
921,Lagoon Spa Seminyak,"Villa Seminyak Estate & Spa, Jl. Nakula Gg. Baik-Baik, Seminyak, Kec. Kuta, Kabupaten Badung, Bali 80361",Kuta,Badung,-8.6956077,115.1722969,Day Spa,Massage,Beauty Treatments,4.5,160,https://g.co/kgs/12UHGeS,,,
922,Sekar Jagat Spa Bali,"Jalan By Pass Ngurah Rai, Jl. Puri Mumbul Permai Jalan Nusa Dua No.96, Bali 80361",Kuta,Badung,-8.7847504,115.1934124,Balinese Spa,Massage,Beauty Treatments,4.9,100,https://g.co/kgs/Mj15EbC,,,
923,"Away Spa, W Bali - Seminyak","Jl. Petitenget, Seminyak, Kec. Kuta Utara, Kabupaten Badung, Bali 80361",Kuta Utara,Badung,-8.6773236,115.1488372,Day Spa,Massage,Beauty Treatments,4.3,22,https://g.co/kgs/XWsWMph,,,
924,Bali Green Spa,"Pertokoan Sunset Permai Blok D, Jalan Sunset Road, Legian, Kec. Kuta, Kabupaten Badung, Bali 80361",Kuta,Badung,-8.701496,115.1797938,Balinese Spa,Massage,Beauty Treatments,4.5,346,https://g.co/kgs/MpqwBst,,,
925,Bhava Spa Kuta,"Jl. Kartika Plaza Gg. Puspa Ayu No.99, Kuta, Kec. Kuta, Kabupaten Badung, Bali 80361",Kuta,Badung,-8.7297366,115.1696907,Balinese Spa,Massage,Beauty Treatments,4.8,283,https://g.co/kgs/hy6rLJK,,,
926,Ubud Traditional Spa,"Jalan Rsi Markandya I Payogan, Kedewatan, Kec. Gianyar, Kabupaten Gianyar, Bali 80571",Gianyar,Gianyar,-8.477359,115.2533,Balinese Spa,Massage,Beauty Treatments,4.9,2500,https://g.co/kgs/qrYLWcw,,,
927,Re Massage Studio,"Jl. Petitenget No.88D, Seminyak, Kec. Kuta Utara, Kabupaten Badung, Bali 80361",Kuta Utara,Badung,-8.6765177,115.1553737,Day Spa,Massage,Beauty Treatments,4.4,500,https://g.co/kgs/URkVJ4p,,,
928,Talise Spa Bali,"Kawasan Pecatu Indah Resort, Jl. Raya Uluwatu Street, Pecatu, Kec. Kuta Sel., Kabupaten Badung, Bali 80361",Kuta Selatan,Badung,-8.7980945,115.1194552,Day Spa,Health club,Beauty Treatments,0.5,4,https://g.co/kgs/bJtEqv9,,,
929,Bali Orchid Spa,"Jl. Bypass Ngurah Rai Suwung Kauh No.108, Pemogan, Denpasar Selatan, Kota Denpasar, Bali 40115",Denpasar Selatan,Denpasar,-8.7216743,115.1898156,Balinese Spa,Massage,Beauty Treatments,4.4,1792,https://g.co/kgs/7TPNgih,,,
930,Spa Bali Camplung Tanduk,"Depan Kimia Farma, Jl. Camplung Tanduk No.100x, Seminyak, Kec. Kuta, Kabupaten Badung, Bali 80361",Kuta,Badung,-8.6913582,115.1646472,Balinese Spa,Massage,Beauty Treatments,4.4,59,https://g.co/kgs/4api5Uw,,,
931,Taman Air Spa,"Jl. Sunset Road No.88, Kuta, Kec. Kuta, Kabupaten Badung, Bali 80361",Kuta,Badung,-8.7072617,115.1829567,Balinese Spa,Massage,Beauty Treatments,4.4,851,https://g.co/kgs/XWjoEYA,,,
932,Spring Spa Seminyak,"Jl. Kayu Jati No.8, Seminyak, Kec. Kuta, Kabupaten Badung, Bali 80361",Kuta,Badung,-8.6833388,115.156449,Day Spa,Massage,Beauty Treatments,4.2,469,https://g.co/kgs/MB5b4th,,,
933,Akoya Spa,"Jl. Lanyahan, Br. Nagi, Kecamatan Ubud, Kabupaten Gianyar, Bali 80571",Ubud,Gianyar,-8.490783283,115.277573,Day Spa,Massage,Beauty Treatments,4.4,27,https://g.co/kgs/jicnXje,,,
934,Putri Bali Spa,"Jl. Raya Sanggingan, Kedewatan, Kecamatan Ubud, Kabupaten Gianyar, Bali",Ubud,Gianyar,-8.4915278,115.2533409,Balinese Spa,Massage,Beauty Treatments,4.7,1952,https://g.co/kgs/3ctmQK1,,,
935,Terapung Float Club,"Jl. Drupadi No.99A, Seminyak, Kec. Kuta, Kabupaten Badung, Bali 80361",Kuta,Badung,-8.6893414,115.1648106,Health Club,Day Spa,Icebath,4.9,216,https://g.co/kgs/BoEeV3k,,,
936,De Nyuh Spa Kuta,"Jl. Bypass Ngurah Rai No.99, Tuban, Kec. Kuta, Kabupaten Badung, Bali 80361",Kuta,Badung,-8.7419319,115.1814986,Balinese Spa,Massage,Beauty Treatments,4.5,206,https://g.co/kgs/xY8C8c8,,,
937,Theta Spa by The Sea,"Bintang Bali Resort, Jl. Kartika Plaza, Kuta, Badung, Bali 80361",Kuta,Badung,-8.7325706,115.1642533,Day Spa,Massage,Beauty Treatments,4.4,124,https://g.co/kgs/UKv73wR,,,
938,Cool Spa,"Jl. Kayu Cendana No.C001, Seminyak, Kec. Kuta, Kabupaten Badung, Bali 80361",Kuta,Badung,-8.68260473,115.1574255,Day Spa,Sport Massage,Beauty Treatments,4.5,256,https://g.co/kgs/n34obHi,,,
939,Sanctuary Bali Spa,"Jl. Danau Buyan No.67, Sanur, Denpasar Selatan, Kota Denpasar, Bali 80227",Denpasar Selatan,Denpasar,-8.6820401,115.2597301,Day Spa,Saloon,Beauty Treatments,4.6,206,https://g.co/kgs/xAs67GJ,,,
940,Heavenly Spa by Westin,"Kompleks ITDC Jl. Nusa Dua No.Lot N3, Benoa, South Kuta, Badung, Bali 80363",Kuta Selatan,Badung,-8.795668835,115.2261812,Day Spa,Sauna,Jacuzzi,4.8,115,https://g.co/kgs/RziBcCq,,,
941,The Nest Beachside Spa,"Jl. Setapak, Sanur, Denpasar Selatan, Kota Denpasar, Bali 80228",Denpasar Selatan,Denpasar,-8.7049168,115.263958,Day Spa,Beachside,Beauty Treatments,4.7,386,https://g.co/kgs/nUxfozj,,,
942,Karsa Spa,"Keliki, Jl. Markandia Jl. Bangkiang Sidem, Ubud, Kec. Tegallalang, Kabupaten Gianyar, Bali 80571",Tegallalang,Gianyar,-8.4895342,115.2583198,Balinese Spa,Rice Field,Beauty Treatments,4.7,1714,https://g.co/kgs/u2HCBLr,,,
943,Sacred River Spa at Four Seasons Resort Bali at Sayan,"Jl. Raya Sayan, Sayan, Kecamatan Ubud, Kabupaten Gianyar, Bali 80571",Ubud,Gianyar,-8.5017488,115.2405935,Luxury Spa,Massage,Beauty Treatments,4.6,88,"https://www.google.com/search?sca_esv=d2fbde582ddfbd7f&cs=0&output=search&q=Sacred+River+Spa+at+Four+Seasons+Resort+Bali+at+Sayan&ludocid=76940103563435499&ibp=gwp;0,7&lsig=AB86z5UBImRJv8Vqom-zjWN6NfLB&kgs=eb22320ef20cb81a&shndl=-1&shem=lsp,ssim&source=sh/x/kp/local/m1/1",,,
944,The Canopy Spa,"Lloyd's Inn Bali, Jl. Arjuna Jl. Double Six, Seminyak, Kuta, Badung, Bali 80361",Kuta,Badung,-8.6964632,115.1640673,Day Spa,Massage,Beauty Treatments,3.9,49,https://g.co/kgs/opZfzDf,,,
945,Home Spa Bali,"Jl. Pratama No.97, Benoa, Kec. Kuta Sel., Kabupaten Badung, Bali 80361",Kuta Selatan,Badung,-8.765962,115.221882,Balinese Spa,Massage,Beauty Treatments,4.7,236,https://g.co/kgs/ZGRSozr,,,
946,The Calma Spa Bali - Jimbaran Beach,"Jl. Uluwatu II No.108X, Jimbaran, Kec. Kuta Sel., Kabupaten Badung, Bali 80361",Kuta Selatan,Badung,-8.784181,115.1709982,Balinese Spa,Massage,Beauty Treatments,4.8,1829,https://g.co/kgs/QE14xqU,,,
947,ASPYA BALI,"Jl. Drupadi No.23, Seminyak, Kec. Kuta, Kabupaten Badung, Bali 80361",Kuta,Badung,-8.6877219,115.164925,Day Spa,Facial,Beauty Treatments,4.4,133,https://g.co/kgs/MuJvDx3,,,
948,Spa at Maya Sanur,"Jl. Danau Tamblingan No.89M, Sanur, Denpasar Selatan, Kota Denpasar, Bali 80228",Denpasar Selatan,Denpasar,-8.6978843,115.2648998,Day Spa,Balinese Spa,Beauty Treatments,0.5,309,https://g.co/kgs/3RwJ6yh,,,
949,LuxMe Bali Spa,"Kori Nuansa Jimbaran, Jl. Nuansa Utama VIII Jl. Taman Griya No.6, Jimbaran, Kec. Kuta Sel., Kabupaten Badung, Bali 80361",Kuta Selatan,Badung,-8.797854,115.1849673,Day Spa,Facial,Beauty Treatments,4.9,52,https://g.co/kgs/sQod1yV,,,
950,Temple Spa Bali,"Jl. Bumbak Anyar Kelod No.44, Kerobokan Kelod, Kec. Kuta Utara, Kabupaten Badung, Bali 80361",Kuta Utara,Badung,-8.6521417,115.1555433,Day Spa,Facial Massage,Beauty Treatments,4.7,270,https://g.co/kgs/wH2TRWE,,,
951,De Nyuh Spa Seminyak,"Grandmas Plus Hotel Seminyak, Jl. Camplung Tanduk No.99 5th Floor, Seminyak, Kuta, Badung, Bali 80361",Kuta,Badung,-8.6921729,115.1615828,Day Spa,Jacuzzi,Beauty Treatments,4.6,602,"https://www.google.com/search?sca_esv=d2fbde582ddfbd7f&cs=0&output=search&q=De+Nyuh+Spa+Seminyak&ludocid=5355306455086312011&ibp=gwp;0,7&lsig=AB86z5VB9vR4W5wJHvKJtSzHikw_&kgs=25d4a4aa8ee5e76c&shndl=-1&shem=lsp,ssim&source=sh/x/kp/local/m1/1",,,
952,LV SPA Bali,"Jl. Camplung Tanduk No.10A, Seminyak, Kec. Kuta, Kabupaten Badung, Bali 80361",Kuta,Badung,-8.6909438,115.1661514,Balinese Spa,Mani Pedi,Beauty Treatments,4.2,96,https://g.co/kgs/6TdBBtW,,,
953,Palmilla Bali Beach Club,"Ungasan, South Kuta, Badung, Bali",Kuta Selatan,Badung,-8.8479375,115.1576875,Beachside,Beach Club,Vegan Dishes,4.4,3032,https://g.co/kgs/tM3Ry8a,"Rp250,000",,
954,Azul Beach Club Bali,"Jl. Padma No.2, Legian, Kec. Kuta, Kabupaten Badung, Bali 80361",Kuta,Badung,-8.7072715,115.1664586,Beachside,Beach Club,Resort,4.5,2058,https://g.co/kgs/H6hQZKA,"Rp250,000",,
955,La Brisa Bali | Beach Club,"Jl. Pantai Batu Mejan, Canggu, Kec. Kuta Utara, Kabupaten Badung, Bali 80361",Kuta Utara,Badung,-8.6542178,115.1250199,Beachside,Beach Club,Bar,4.5,12810,https://g.co/kgs/Kz39Spn,"Rp350,000",,
956,The Beach Club at Courtyard by Marriott Bali Nusa Resort Dua,"Peninsula Beach, Nusa Dua, Benoa, South Kuta, Badung, Bali 80363",Kuta Selatan,Badung,-8.8026195,115.2359952,Beachside,Beach Club,Luxurious,4.5,430,https://g.co/kgs/gcwVGW2,"Rp450,000",,
957,Mïnoo Beach Club,"Jl. Pengayutan. Pantai Melasti, Ungasan, South Kuta, Badung, Bali",Kuta Selatan,Badung,-8.8482789,115.161177,Beachside,Beach Club,Bar,4.5,713,https://g.co/kgs/aiVvwam,"Rp250,000",,
958,Mari Beach Club Bali,"Jl. Batu Belig No.66, Kerobokan Kelod, Kec. Kuta Utara, Bali, 80361",Kuta Utara,Badung,-8.673399,115.146549,Beachside,Beach Club,Bar,4.5,1687,https://g.co/kgs/3QJRzSx,"Rp250,000",,
959,COMO Beach Club,"Jl. Pantai Batu Mejan, Canggu, Kec. Kuta Utara, Kabupaten Badung, Bali 80361",Kuta Utara,Badung,-8.655531121,115.1263471,Beachside,Beach Club,Live Music,4.5,821,https://g.co/kgs/NeiVoKo,"Rp250,000",,
960,Sundays Beach Club,"Jl. Pantai Sel. Gau Banjar Wijaya Kusuma, Ungasan, Kec. Kuta Sel., Kabupaten Badung, Bali 80362",Kuta Selatan,Badung,-8.8471797,115.1507886,Beachside,Beach Club,Restaurant,4.5,3434,https://g.co/kgs/vz8Uy2Z,"Rp250,000",,
961,Kubu Beach Club,"AYANA Resort and Spa, Jl. Karang Mas Sejahtera, Jimbaran, Kec. Kuta Sel., Kabupaten Badung, Bali 80364",Kuta Selatan,Badung,-8.7879753,115.1330871,Beachside,Indonesian Food,Bar,4.4,188,https://g.co/kgs/jaKTVa6,"Rp250,000",,
962,Sakala Beach Club,"Jl. Pratama No.95, Tj. Benoa, Kec. Kuta Sel., Kabupaten Badung, Bali 80361",Kuta Selatan,Badung,-8.759307,115.2219883,Beachside,Resort,Bar,4.5,334,https://g.co/kgs/BdBHAk3,"Rp250,000",,
963,Infinity Beach Club,"Seminyak, Bali, Badung, Bali 80361",Kuta,Badung,-8.6865921,115.1539623,Beachside,Beach Club,Live Music,4.5,137,https://g.co/kgs/QCtxMab,"Rp250,000",,
964,Reef Beach Club,"Jl. Raya Nusa Dua Selatan, Sawangan, Nusa Dua, Kec. Kuta Sel., Kabupaten Badung, Bali 80361",Kuta Selatan,Badung,-8.830053,115.2188139,Beachside,Beach Club,Vegan Dishes,4.5,330,https://g.co/kgs/8Pv2kzK,"Rp250,000",,
965,FINNS Beach Club,"Jl. Pantai Berawa No.99, Canggu, Kec. Kuta Utara, Kabupaten Badung, Bali 80361",Kuta Utara,Badung,-8.6667652,115.1393984,Beachside,Beach Club,Vegan Dishes,4.4,18000,https://g.co/kgs/LdLwuae,"Rp250,000",,
966,Vue Beach Club Canggu,"Jalan Pantai Berawa.100XX Tibubeneng, Canggu, Kec. Kuta Utara, Kabupaten Badung, Bali 80361",Kuta Utara,Badung,-8.6685411,115.1412829,Beachside,Beach Club,Vegan Dishes,4.3,980,https://g.co/kgs/mjz4GgG,"Rp250,000",,
